set,Real_Score,Real_Rank,Syn_Score,Syn_Rank
long-chain fatty-acyl-CoA biosynthetic process (GO:0035338),0.36310955275697554,3702.0,0.6722837830248394,1267.0
positive regulation of response to biotic stimulus (GO:0002833),0.36304684764797107,3703.0,0.3946954160144069,4068.0
embryonic digit morphogenesis (GO:0042733),0.36300649321862705,3704.0,0.4567499904192597,3421.0
dopaminergic neuron differentiation (GO:0071542),0.36300077122957913,3705.0,0.5434417538704862,2379.0
peptidyl-tyrosine dephosphorylation (GO:0035335),0.36294594328296076,3706.0,0.5226898634117789,2626.0
regulation of steroid metabolic process (GO:0019218),0.3628749654083212,3707.0,0.4626731780883045,3365.0
cellular response to interleukin-17 (GO:0097398),0.36235806029854584,3708.5,0.3834334273844667,4159.5
interleukin-17-mediated signaling pathway (GO:0097400),0.36235806029854584,3708.5,0.3834334273844667,4159.5
establishment of endothelial barrier (GO:0061028),0.36234828602049046,3710.0,0.3257421121745399,4522.0
negative regulation of multicellular organismal process (GO:0051241),0.3623026303684018,3711.0,0.40514847383054486,3966.0
blood vessel endothelial cell migration (GO:0043534),0.36229767516809597,3712.0,0.3256959711775422,4523.0
regulation of muscle contraction (GO:0006937),0.3620521279122997,3713.0,0.36069999502735933,4331.0
positive regulation of fatty acid biosynthetic process (GO:0045723),0.3617544302714977,3714.0,0.3627973495191571,4314.0
keratinocyte differentiation (GO:0030216),0.36146952331546395,3715.0,0.36468488681923084,4298.0
B cell receptor signaling pathway (GO:0050853),0.3614629243620874,3716.0,0.46193296341820583,3372.0
protein K48-linked deubiquitination (GO:0071108),0.3613586372661031,3717.0,0.22629201110590283,4887.0
erythrose 4-phosphate/phosphoenolpyruvate family amino acid metabolic process (GO:1902221),0.36130723806318027,3718.0,0.2285682718926735,4882.0
defense response to symbiont (GO:0140546),0.36128183250459006,3719.0,0.43593610286565904,3671.0
regulation of trophoblast cell migration (GO:1901163),0.361039484066307,3720.0,0.4365014236779832,3664.0
bundle of His cell action potential (GO:0086043),0.3609885170949026,3721.0,0.413531821007915,3886.0
embryonic camera-type eye development (GO:0031076),0.3608392240269751,3722.0,0.3807309153692375,4180.0
positive regulation of lipid metabolic process (GO:0045834),0.36077413615558585,3723.0,0.4566737071584867,3423.0
ISG15-protein conjugation (GO:0032020),0.3606820333553541,3724.0,0.47008942735772397,3266.0
long-chain fatty-acyl-CoA metabolic process (GO:0035336),0.360665767357076,3725.0,0.6533549401411457,1397.0
regulation of ubiquitin-dependent protein catabolic process (GO:2000058),0.3605628376718003,3726.0,0.5078521638750694,2803.0
store-operated calcium entry (GO:0002115),0.3605521687111735,3727.0,0.6118490926273076,1695.0
positive regulation of potassium ion transport (GO:0043268),0.3605123090389051,3728.0,0.41577330053241524,3867.0
protein-containing complex disassembly (GO:0032984),0.36048610550653276,3729.0,0.5384593238211027,2444.0
negative regulation of cardiac muscle hypertrophy (GO:0010614),0.3604773130939405,3730.0,0.4347966881642046,3681.0
negative regulation of proteolysis (GO:0045861),0.36044117264747894,3731.0,0.4355142225870657,3674.0
positive regulation of isotype switching (GO:0045830),0.3603801036115505,3732.0,0.4697163686203735,3268.0
arginine catabolic process (GO:0006527),0.36017158438834235,3733.0,0.6288778841299959,1569.0
unsaturated fatty acid metabolic process (GO:0033559),0.36008231246337,3734.0,0.5315301469932721,2530.0
positive regulation of cellular protein catabolic process (GO:1903364),0.3600420140255763,3735.0,0.40158206709763844,4003.0
regulation of protein dephosphorylation (GO:0035304),0.35983824352931393,3736.0,0.5345729295936026,2495.0
in utero embryonic development (GO:0001701),0.3596266955205233,3737.0,0.3969253844045424,4053.0
negative regulation of tumor necrosis factor production (GO:0032720),0.35958055044814563,3738.0,0.4725398752622876,3238.0
positive regulation of morphogenesis of an epithelium (GO:1905332),0.35953010788251033,3739.0,0.4705694598731637,3259.0
negative regulation of heterotypic cell-cell adhesion (GO:0034115),0.35947306869519685,3740.5,0.4989931999247578,2902.5
regulation of cell-cell adhesion involved in gastrulation (GO:0070587),0.35947306869519685,3740.5,0.4989931999247578,2902.5
collagen fibril organization (GO:0030199),0.35933116327855147,3742.0,0.4219291700932442,3806.0
positive regulation of cell adhesion mediated by integrin (GO:0033630),0.35911159069121246,3743.0,0.34543877072014983,4411.0
positive regulation of calcium ion transport (GO:0051928),0.3590775686893503,3744.0,0.4655456739527504,3329.0
water transport (GO:0006833),0.35904088058193706,3745.0,0.32372911813353955,4537.0
cardiac ventricle morphogenesis (GO:0003208),0.3590033911222705,3746.0,0.3847864922817186,4152.0
regulation of microglial cell mediated cytotoxicity (GO:1904149),0.35893331014703256,3747.0,0.32201722292272167,4543.0
regulation of cell activation (GO:0050865),0.3589023447525052,3748.0,0.32949320238655205,4504.0
positive regulation of leukocyte apoptotic process (GO:2000108),0.3587193257275739,3749.0,0.38025902341169093,4183.0
regulation of receptor signaling pathway via JAK-STAT (GO:0046425),0.3587094983627148,3750.0,0.45961796045340997,3391.0
regulation of cell adhesion mediated by integrin (GO:0033628),0.35868397322822515,3751.0,0.3411504004151896,4432.0
negative regulation of antigen receptor-mediated signaling pathway (GO:0050858),0.3586330934184408,3752.0,0.4390766059933104,3631.0
regulation of glycogen metabolic process (GO:0070873),0.3585576357337443,3753.0,0.42436439241926166,3775.0
histone H2B ubiquitination (GO:0033523),0.3585000257504094,3754.0,0.5314427836828448,2533.0
cell fate commitment involved in formation of primary germ layer (GO:0060795),0.3584728481574593,3755.0,0.5687929114536118,2061.0
cardiac muscle cell differentiation (GO:0055007),0.35838335390541837,3756.0,0.4705025647514816,3262.0
positive regulation of cytosolic calcium ion concentration (GO:0007204),0.3583297559289879,3757.0,0.43510808918587557,3677.0
eye development (GO:0001654),0.35823066040343166,3758.0,0.43866452061881955,3635.0
cellular response to organonitrogen compound (GO:0071417),0.35805041954319644,3759.0,0.3751513153010306,4229.0
regulation of protein localization to early endosome (GO:1902965),0.3579326663168032,3761.0,0.556569024612311,2206.0
positive regulation of protein localization to endosome (GO:1905668),0.3579326663168032,3761.0,0.556569024612311,2206.0
positive regulation of protein localization to early endosome (GO:1902966),0.3579326663168032,3761.0,0.556569024612311,2206.0
choline catabolic process (GO:0042426),0.3579165702088856,3763.0,0.4709487065086792,3254.0
endodermal cell differentiation (GO:0035987),0.35780711165973295,3764.0,0.448528662865653,3534.0
sphingolipid catabolic process (GO:0030149),0.35768428445617984,3765.0,0.46186925265722245,3374.0
axon regeneration (GO:0031103),0.3575484750002264,3766.0,0.6134749541647241,1679.0
negative regulation of cytokine production (GO:0001818),0.3574929664393358,3767.0,0.4281465016231423,3744.0
peripheral nervous system neuron development (GO:0048935),0.35740589433327385,3768.0,0.42205844990460645,3803.0
reverse cholesterol transport (GO:0043691),0.3573582377786194,3769.0,0.3094063449540715,4602.0
positive regulation of dendritic spine development (GO:0060999),0.35734179182252834,3770.0,0.43341763504437264,3693.0
regulation of lamellipodium assembly (GO:0010591),0.35723413287951283,3771.0,0.46972169087251014,3267.0
negative regulation of glucose import (GO:0046325),0.35718565462153345,3772.0,0.45982285110020826,3390.0
regulation of hippo signaling (GO:0035330),0.3570691370606955,3773.0,0.26367900702640007,4788.0
gliogenesis (GO:0042063),0.3570659587820196,3774.0,0.42479916591195027,3771.0
positive regulation of reproductive process (GO:2000243),0.3570081911458801,3775.0,0.36350698213194654,4307.0
regulation of cellular response to growth factor stimulus (GO:0090287),0.3569911904116755,3776.0,0.3747731506733242,4234.0
regulation of peptide hormone secretion (GO:0090276),0.35699118677381486,3777.0,0.48264461745344217,3112.0
negative regulation of nervous system development (GO:0051961),0.3568591218855936,3778.0,0.37169940898886084,4258.0
chondroitin sulfate metabolic process (GO:0030204),0.35676535929921627,3779.0,0.3759524514326125,4223.0
negative regulation of endopeptidase activity (GO:0010951),0.3567002366111264,3780.0,0.4468185984763148,3552.0
positive regulation of striated muscle cell differentiation (GO:0051155),0.35665194361703767,3781.0,0.5057000322531686,2830.0
positive regulation of interferon-alpha production (GO:0032727),0.356532466704879,3782.0,0.530824420423595,2543.0
phospholipid biosynthetic process (GO:0008654),0.3565056268187496,3783.0,0.4498692505591563,3524.0
amine metabolic process (GO:0009308),0.3563101685569336,3784.0,0.3171581494382706,4569.0
regulation of androgen receptor signaling pathway (GO:0060765),0.3561758230444421,3785.0,0.6781403698836463,1235.0
cellular response to misfolded protein (GO:0071218),0.35605458872269174,3786.0,0.6571520094964931,1377.0
heart trabecula morphogenesis (GO:0061384),0.355906818075058,3787.0,0.4135446437281041,3885.0
canonical Wnt signaling pathway (GO:0060070),0.3557980657339297,3788.0,0.538597983340082,2442.0
positive regulation of histone H3-K4 methylation (GO:0051571),0.3557631116854065,3789.0,0.6040106299636425,1748.0
regulation of NK T cell proliferation (GO:0051140),0.3556933725980028,3790.0,0.6105222990045169,1704.0
regulation of non-canonical Wnt signaling pathway (GO:2000050),0.35557983425390577,3791.0,0.4098508900715889,3920.0
fatty acid transport (GO:0015908),0.3555642535490225,3792.0,0.3955904101930741,4065.0
positive regulation of vascular endothelial growth factor production (GO:0010575),0.3555068359456825,3793.5,0.5675321272921818,2073.5
regulation of vascular endothelial growth factor production (GO:0010574),0.3555068359456825,3793.5,0.5675321272921818,2073.5
tricarboxylic acid metabolic process (GO:0072350),0.3553892178401346,3795.0,0.46491796658425816,3337.0
regulation of cholesterol esterification (GO:0010872),0.35530535790691414,3796.0,0.3767861560614038,4214.0
dendritic cell differentiation (GO:0097028),0.3552159235661767,3797.0,0.3726092912014043,4251.0
negative regulation of dendritic cell apoptotic process (GO:2000669),0.3551894446774809,3798.0,0.4541794391079475,3460.0
posttranscriptional regulation of gene expression (GO:0010608),0.3551279683407912,3799.0,0.539605832682511,2428.0
regulation of smoothened signaling pathway (GO:0008589),0.35504262044401874,3800.0,0.5823581046016099,1933.0
COPII-coated vesicle budding (GO:0090114),0.3549372137284592,3801.0,0.4677680277989065,3295.0
plasminogen activation (GO:0031639),0.35490827612772863,3802.0,0.4247586169315434,3772.0
positive regulation of macroautophagy (GO:0016239),0.3548805381204888,3803.0,0.4763405383027014,3188.0
negative regulation of dephosphorylation (GO:0035305),0.3547249272249212,3804.0,0.5196590790795272,2666.0
hippo signaling (GO:0035329),0.3546919895480964,3805.0,0.38316965810675907,4162.0
water homeostasis (GO:0030104),0.3546705998452829,3806.0,0.401463972170654,4006.0
neuron fate commitment (GO:0048663),0.3546616389599924,3807.0,0.4338207170787333,3690.0
myeloid dendritic cell activation (GO:0001773),0.35462228026395876,3808.0,0.2764814930429575,4745.0
regulation of bone mineralization (GO:0030500),0.35458390403610546,3809.0,0.4506498653927758,3508.0
negative regulation of G protein-coupled receptor signaling pathway (GO:0045744),0.35452419105827804,3810.0,0.4552877096233753,3442.0
cellular response to chemokine (GO:1990869),0.35451513910325533,3811.0,0.38168829238872304,4169.0
female gamete generation (GO:0007292),0.3544707721705055,3812.0,0.47901782547311644,3158.0
purine ribonucleotide transport (GO:0015868),0.35436750087294355,3813.5,0.5081871606588998,2797.5
adenine nucleotide transport (GO:0051503),0.35436750087294355,3813.5,0.5081871606588998,2797.5
base conversion or substitution editing (GO:0016553),0.35430348578765014,3815.0,0.3923588981933317,4091.0
positive regulation of fatty acid beta-oxidation (GO:0032000),0.3542031469261722,3816.0,0.3616482539512929,4324.0
telencephalon cell migration (GO:0022029),0.354202747437912,3817.0,0.6640309912383222,1330.0
regulation of epithelial cell differentiation (GO:0030856),0.354181435292253,3818.0,0.2814105133500485,4732.0
peripheral nervous system development (GO:0007422),0.3541696752577604,3819.0,0.48423926160102865,3090.0
sodium ion import across plasma membrane (GO:0098719),0.3538615967845164,3820.0,0.3654124570759649,4295.0
regulation of RNA biosynthetic process (GO:2001141),0.3538249372161512,3821.0,0.5557499935699276,2214.0
negative regulation of peptidyl-tyrosine phosphorylation (GO:0050732),0.35381511044119807,3822.0,0.47561440903437824,3199.0
myeloid dendritic cell differentiation (GO:0043011),0.3537174779145772,3823.0,0.28048236545539307,4736.0
cardiac muscle cell proliferation (GO:0060038),0.35370619352639426,3824.5,0.4602367926456392,3385.5
striated muscle cell proliferation (GO:0014855),0.35370619352639426,3824.5,0.4602367926456392,3385.5
regulation of leukocyte adhesion to vascular endothelial cell (GO:1904994),0.3536947559782252,3826.0,0.19926966242238467,4919.0
positive regulation of biosynthetic process (GO:0009891),0.35368717770423186,3827.0,0.41676225420661445,3858.0
N-glycan processing (GO:0006491),0.35364531951401085,3828.0,0.8460418861946895,533.0
immune response-regulating cell surface receptor signaling pathway (GO:0002768),0.35354469191883026,3829.0,0.40604385136131693,3953.0
protein kinase A signaling (GO:0010737),0.3535417823755152,3830.0,0.286402329652408,4711.0
extracellular matrix organization (GO:0030198),0.35341464665107025,3831.0,0.43135174258179787,3708.0
positive regulation of granulocyte macrophage colony-stimulating factor production (GO:0032725),0.35326236002710837,3832.0,0.5672902260876884,2076.0
dendritic spine organization (GO:0097061),0.3532255518037658,3833.0,0.4223032207279843,3798.0
regulation of interleukin-17 production (GO:0032660),0.35317925596187766,3834.0,0.4268316335936625,3753.0
"positive regulation of phagocytosis, engulfment (GO:0060100)",0.3530745575571503,3835.0,0.5006852926877547,2883.0
regulation of ion transmembrane transport (GO:0034765),0.35296146180150456,3836.0,0.4645307823949939,3345.0
response to muscle stretch (GO:0035994),0.3529487353969846,3837.0,0.37529214324343935,4227.0
response to interferon-beta (GO:0035456),0.35276429245106816,3838.0,0.3310099935637019,4488.0
regulation of serine-type endopeptidase activity (GO:1900003),0.3527593140129529,3839.0,0.15477063134922878,4964.0
"mRNA cis splicing, via spliceosome (GO:0045292)",0.35269787046993006,3840.0,0.5960952509842529,1807.0
cardiac myofibril assembly (GO:0055003),0.3526781738524725,3841.0,0.3054108198403071,4618.0
positive regulation of response to cytokine stimulus (GO:0060760),0.3525506939714061,3842.0,0.3617857113630572,4323.0
regulation of extracellular matrix constituent secretion (GO:0003330),0.35254613332223816,3843.0,0.46872582339051994,3281.0
negative regulation of growth (GO:0045926),0.35252292797339235,3844.0,0.4086547438883778,3928.0
determination of digestive tract left/right asymmetry (GO:0071907),0.35232672566330536,3845.0,0.504092176547861,2846.0
neurotrophin signaling pathway (GO:0038179),0.3522973860567702,3846.0,0.31893939108004443,4563.0
protein localization to cell surface (GO:0034394),0.35220640228134975,3847.0,0.40458182492002087,3972.0
negative regulation of ossification (GO:0030279),0.3519797898084415,3848.0,0.4784637252864898,3167.0
antigen processing and presentation of peptide antigen via MHC class I (GO:0002474),0.351942604115415,3849.0,0.5842700976858425,1919.0
3'-phosphoadenosine 5'-phosphosulfate metabolic process (GO:0050427),0.35191629057266455,3850.0,0.32529871376617747,4525.0
stress fiber assembly (GO:0043149),0.35183898748744646,3851.5,0.5988348535567766,1786.5
contractile actin filament bundle assembly (GO:0030038),0.35183898748744646,3851.5,0.5988348535567766,1786.5
regulation of dendritic cell apoptotic process (GO:2000668),0.3517352091064072,3853.0,0.39673537735320746,4056.0
positive regulation of chemotaxis (GO:0050921),0.35165706417737524,3854.0,0.35167420157139395,4389.0
negative regulation of cellular protein localization (GO:1903828),0.35157884853544213,3855.0,0.35368911136844966,4372.0
DNA dealkylation involved in DNA repair (GO:0006307),0.3515433848978783,3856.5,0.4972528092790539,2934.5
DNA dealkylation (GO:0035510),0.3515433848978783,3856.5,0.4972528092790539,2934.5
protein insertion into membrane (GO:0051205),0.35121035215725854,3858.0,0.4460057720674307,3563.0
endocardial cushion morphogenesis (GO:0003203),0.35114372207682715,3859.0,0.40705676790580114,3941.0
maintenance of gastrointestinal epithelium (GO:0030277),0.35081006395618247,3860.0,0.4243081796260943,3777.0
ventricular septum morphogenesis (GO:0060412),0.35047655894809865,3861.0,0.493952580407246,2975.0
positive regulation of lymphocyte apoptotic process (GO:0070230),0.35010512673375516,3862.0,0.3022024214433553,4635.0
cellular response to acid chemical (GO:0071229),0.35009676500234616,3863.0,0.23913814250534374,4853.0
Cdc42 protein signal transduction (GO:0032488),0.34989984485902353,3864.0,0.6431415461812332,1473.0
positive regulation of leukocyte cell-cell adhesion (GO:1903039),0.34988514670712106,3865.0,0.35466729380045076,4364.0
odontogenesis (GO:0042476),0.34987072812542597,3866.0,0.3597416887743987,4337.0
mammary gland development (GO:0030879),0.34972033107766815,3867.0,0.329995786265277,4497.0
metal ion export (GO:0070839),0.3493344241600416,3868.0,0.3761067789594058,4222.0
positive regulation of stem cell differentiation (GO:2000738),0.34921805997530997,3869.0,0.4982077252585905,2916.0
response to alkaloid (GO:0043279),0.34910827708193315,3870.0,0.737041648025409,920.0
protein N-linked glycosylation (GO:0006487),0.3490710115449996,3871.0,0.5805087765926334,1949.0
positive regulation of leukocyte migration (GO:0002687),0.3489074584696674,3872.0,0.31788530245675994,4565.0
regulation of epithelial cell migration (GO:0010632),0.34890715466302025,3873.0,0.39978407425839735,4017.0
negative regulation of signal transduction by p53 class mediator (GO:1901797),0.3488900194894093,3874.0,0.3514719202933709,4390.0
negative regulation of Notch signaling pathway (GO:0045746),0.3487598604759205,3875.0,0.43809336039152036,3640.0
SA node cell action potential (GO:0086015),0.3486176847691978,3876.0,0.4089388033288266,3925.0
response to metal ion (GO:0010038),0.3483525579443936,3877.0,0.40514383089326184,3967.0
immune response-activating cell surface receptor signaling pathway (GO:0002429),0.3482648312808357,3878.0,0.38651057052505605,4138.0
pharyngeal system development (GO:0060037),0.3482141385484629,3879.0,0.4134360937676992,3889.0
negative regulation of cytokine-mediated signaling pathway (GO:0001960),0.3480338350283168,3880.0,0.49753285921175605,2928.0
positive regulation of cell development (GO:0010720),0.3479588334038428,3881.0,0.5281169127671358,2570.0
endoplasmic reticulum calcium ion homeostasis (GO:0032469),0.3479472817126881,3882.0,0.30891572630378805,4605.0
negative regulation of cartilage development (GO:0061037),0.3479245991068345,3883.5,0.2915901760602562,4689.5
negative regulation of chondrocyte differentiation (GO:0032331),0.3479245991068345,3883.5,0.2915901760602562,4689.5
regulation of MAP kinase activity (GO:0043405),0.34776126688958947,3885.0,0.3890439483624491,4116.0
sensory perception of light stimulus (GO:0050953),0.34775702693895555,3886.0,0.39851076171001704,4037.0
cellular glucan metabolic process (GO:0006073),0.3476370143457305,3887.0,0.28890387287295455,4697.0
negative regulation of NIK/NF-kappaB signaling (GO:1901223),0.34754054141762625,3888.0,0.45661085373464433,3426.0
negative regulation of centriole replication (GO:0046600),0.3473987743598936,3889.0,0.6130616924419677,1685.0
regulation of fibrinolysis (GO:0051917),0.3473751796323605,3890.0,0.43234034902514495,3699.0
protein kinase B signaling (GO:0043491),0.34707701259552637,3891.0,0.39867753099978437,4036.0
protein deneddylation (GO:0000338),0.3470427118043419,3892.0,0.4679650703386908,3291.0
glycosphingolipid metabolic process (GO:0006687),0.347038770259882,3893.0,0.4532600711847919,3467.0
embryonic appendage morphogenesis (GO:0035113),0.3470180291577101,3894.0,0.42929704463145507,3730.0
excitatory postsynaptic potential (GO:0060079),0.3469954944556499,3895.0,0.5515955124688685,2264.0
dorsal/ventral pattern formation (GO:0009953),0.3469639914971975,3896.0,0.4997777862335172,2899.0
triglyceride metabolic process (GO:0006641),0.34677879990283433,3897.0,0.4070625997551333,3940.0
negative regulation of catalytic activity (GO:0043086),0.34673492589531885,3898.0,0.48700447765402766,3060.0
regulation of response to external stimulus (GO:0032101),0.34670573609605015,3899.0,0.39153156379267867,4097.0
cell-cell junction maintenance (GO:0045217),0.3466988612929048,3900.0,0.40059143167576866,4010.0
positive regulation of protein glycosylation (GO:0060050),0.3466235557380457,3901.0,0.3325592580619881,4480.0
regulation of focal adhesion assembly (GO:0051893),0.3464046234066528,3902.0,0.32867414898845926,4511.0
glycolipid metabolic process (GO:0006664),0.34637381769908193,3903.0,0.43471351729740676,3683.0
lymphocyte migration (GO:0072676),0.3463552885250167,3904.0,0.4067995974343375,3945.0
regulation of dendritic cell differentiation (GO:2001198),0.34628985859968575,3905.0,0.331894653825365,4484.0
cardiac muscle cell development (GO:0055013),0.34593513707924806,3906.0,0.3574076508255557,4346.0
receptor transactivation (GO:0035624),0.3458636626827498,3907.0,0.40397864932015914,3981.0
ether lipid metabolic process (GO:0046485),0.34573537735199233,3908.0,0.5748185822831193,2014.0
leukocyte adhesion to vascular endothelial cell (GO:0061756),0.34543105077801933,3909.0,0.41831428689769784,3841.0
positive regulation of unsaturated fatty acid biosynthetic process (GO:2001280),0.34518065297263545,3910.0,0.38375009263789706,4158.0
negative regulation of histone methylation (GO:0031061),0.3451567342903352,3911.0,0.19023199682381672,4930.0
renal filtration (GO:0097205),0.3451103380559535,3912.5,0.4527874802034275,3479.5
glomerular filtration (GO:0003094),0.3451103380559535,3912.5,0.4527874802034275,3479.5
regulation of homotypic cell-cell adhesion (GO:0034110),0.34495638805327894,3914.0,0.3810237349284033,4176.0
leukocyte tethering or rolling (GO:0050901),0.3448161449325371,3915.0,0.4124122544158851,3896.0
entry into host (GO:0044409),0.3448150358980195,3916.0,0.599453139384961,1782.0
stabilization of membrane potential (GO:0030322),0.3448068286129982,3917.0,0.44858099770505766,3533.0
regulation of endothelial cell migration (GO:0010594),0.34471883197855174,3918.0,0.38980053922395747,4108.0
regulation of integrin-mediated signaling pathway (GO:2001044),0.34445370779496143,3919.0,0.33672093718264273,4453.0
negative regulation of leukocyte mediated cytotoxicity (GO:0001911),0.34440808337636564,3920.0,0.38634388620828974,4141.0
regulation of interferon-gamma production (GO:0032649),0.3443033723921472,3921.0,0.4484395175856182,3535.0
positive regulation of histone methylation (GO:0031062),0.34426827975513163,3922.0,0.42742368205234915,3748.0
microvillus assembly (GO:0030033),0.344238946102357,3923.0,0.4738216869108305,3221.0
adenosine metabolic process (GO:0046085),0.34418609499021313,3924.0,0.7236922300633002,995.0
filopodium assembly (GO:0046847),0.34414915300252275,3925.0,0.5991889950906093,1784.0
positive regulation of epithelial cell proliferation (GO:0050679),0.34396091687379976,3926.0,0.4178828067941297,3846.0
regulation of endothelial cell differentiation (GO:0045601),0.343946719113405,3927.0,0.555446798505519,2221.0
acylglycerol catabolic process (GO:0046464),0.3436273522716142,3928.0,0.47084631532008436,3255.0
negative regulation of smooth muscle cell migration (GO:0014912),0.3434039056596973,3929.0,0.4960905379198297,2950.0
porphyrin-containing compound catabolic process (GO:0006787),0.3433947656952902,3930.5,0.2557415722616667,4817.5
heme catabolic process (GO:0042167),0.3433947656952902,3930.5,0.2557415722616667,4817.5
ethanol metabolic process (GO:0006067),0.3433472908774037,3932.0,0.2854300210832836,4715.0
regulation of ossification (GO:0030278),0.3433335892198588,3933.0,0.41098642566018717,3911.0
positive regulation of integrin-mediated signaling pathway (GO:2001046),0.3432591503578691,3934.0,0.35102316370573866,4392.0
negative regulation of tumor necrosis factor superfamily cytokine production (GO:1903556),0.34309921018776823,3935.0,0.4908670593954016,3013.0
neural crest cell differentiation (GO:0014033),0.34308243779028225,3936.0,0.5782684807177811,1971.0
growth hormone receptor signaling pathway (GO:0060396),0.3430439392769799,3937.0,0.4222668981830017,3799.0
membrane lipid catabolic process (GO:0046466),0.3427169149632457,3938.0,0.36491786132010523,4297.0
alpha-amino acid catabolic process (GO:1901606),0.3424341510592706,3939.0,0.39109375925509093,4101.0
regulation of transforming growth factor beta2 production (GO:0032909),0.3423711772952162,3940.0,0.43604030039218916,3669.0
negative regulation of cell junction assembly (GO:1901889),0.3423118464007198,3941.0,0.4045897841568456,3971.0
negative regulation of NF-kappaB transcription factor activity (GO:0032088),0.342218613968866,3942.0,0.5344002078949205,2498.0
endoderm formation (GO:0001706),0.3420890258950969,3943.0,0.40693365984839036,3942.0
positive regulation of cell motility (GO:2000147),0.34189939054539226,3944.0,0.4071613155847197,3939.0
regulation of interleukin-10 production (GO:0032653),0.3418805769304815,3945.0,0.44587724629412684,3565.0
ovarian follicle development (GO:0001541),0.34182582965715647,3946.0,0.5173853146031653,2696.0
