set,Real_Score,Real_Rank,Syn_Score,Syn_Rank
activation of GTPase activity (GO:0090630),0.454510585585712,2480.0,0.5093759717548899,2787.0
entrainment of circadian clock by photoperiod (GO:0043153),0.454506110973684,2481.0,0.5300107664412096,2549.0
regulation of oxidative stress-induced intrinsic apoptotic signaling pathway (GO:1902175),0.45446928644451323,2482.0,0.5422407193395686,2397.0
regulation of cilium assembly (GO:1902017),0.4544606822339941,2483.0,0.5441676581064714,2366.0
cellular protein modification process (GO:0006464),0.45433564402295873,2484.0,0.5597111147641735,2171.0
terpenoid metabolic process (GO:0006721),0.4542782542351891,2485.0,0.4711789498165158,3252.0
ephrin receptor signaling pathway (GO:0048013),0.45407033452868995,2486.0,0.5218486207159828,2638.0
cellular component assembly (GO:0022607),0.45386287395498026,2487.0,0.5614240956744081,2154.0
positive regulation of cellular amide metabolic process (GO:0034250),0.45378857142649226,2488.0,0.604756540253775,1744.0
microglial cell activation (GO:0001774),0.45364406414038766,2489.0,0.39990311388596456,4015.0
glucan biosynthetic process (GO:0009250),0.4535653938757072,2490.5,0.4418458500501811,3604.5
glycogen biosynthetic process (GO:0005978),0.4535653938757072,2490.5,0.4418458500501811,3604.5
ventricular septum development (GO:0003281),0.453497334964021,2492.0,0.5640406718111276,2115.0
protein localization to plasma membrane (GO:0072659),0.4534194596817706,2493.0,0.4688278895779506,3276.0
positive regulation of blood circulation (GO:1903524),0.45329393692792835,2494.0,0.7083048820650141,1066.0
mesenchymal to epithelial transition (GO:0060231),0.4532819391816399,2495.0,0.7194621234117573,1009.0
neutral amino acid transport (GO:0015804),0.4531763115131978,2496.0,0.5753574116949305,2005.0
axonogenesis (GO:0007409),0.45313583045900807,2497.0,0.5468461522603861,2324.0
regulation of protein kinase activity (GO:0045859),0.45310077472155647,2498.0,0.6100990070914558,1707.0
positive regulation of regulatory T cell differentiation (GO:0045591),0.45298453222484136,2499.0,0.5014430642969863,2870.0
interleukin-27-mediated signaling pathway (GO:0070106),0.45281418223473857,2500.0,0.41752626297650836,3848.0
positive regulation of cell morphogenesis involved in differentiation (GO:0010770),0.45271377651821937,2501.0,0.4734176371323156,3227.0
renal system development (GO:0072001),0.4527055085158123,2502.0,0.5339440837128736,2507.0
regulation of sodium ion transport (GO:0002028),0.4525708354347811,2503.0,0.500322127521505,2890.0
negative regulation of leukocyte apoptotic process (GO:2000107),0.45250763222798057,2504.0,0.5078658979802854,2802.0
regulation of keratinocyte apoptotic process (GO:1902172),0.4524685927975974,2505.0,0.41524260906711224,3870.0
regulation of leukocyte chemotaxis (GO:0002688),0.4524281695120744,2506.0,0.28609438416872773,4712.0
regulation of establishment of cell polarity (GO:2000114),0.45237211800770594,2507.0,0.5207537245791874,2653.0
positive regulation of immunoglobulin production (GO:0002639),0.45227151143354954,2508.0,0.5346959859439886,2493.0
regulation of mitochondrial gene expression (GO:0062125),0.45214666140962534,2509.0,0.6225516940136228,1616.0
regulation of natural killer cell mediated cytotoxicity (GO:0042269),0.45214520910553185,2510.0,0.531778232979312,2527.0
positive regulation of cytoskeleton organization (GO:0051495),0.45212969540033576,2511.0,0.515210335717277,2723.0
regulation of cysteine-type endopeptidase activity involved in apoptotic process (GO:0043281),0.4521273609605121,2512.0,0.5486607095262851,2302.0
poly(A)+ mRNA export from nucleus (GO:0016973),0.4520373639630055,2513.0,0.5198513388297826,2662.0
regulation of cell communication (GO:0010646),0.45201661767995904,2514.0,0.46325414482807714,3359.0
cellular response to interleukin-1 (GO:0071347),0.4520016260851906,2515.0,0.59542461238169,1813.0
regulation of sodium ion transmembrane transporter activity (GO:2000649),0.4519060740405744,2516.0,0.5061519575877625,2824.0
positive regulation of focal adhesion assembly (GO:0051894),0.45188040632457804,2517.5,0.334989734602816,4467.5
positive regulation of cell-substrate junction organization (GO:0150117),0.45188040632457804,2517.5,0.334989734602816,4467.5
protein hydroxylation (GO:0018126),0.45180020241552526,2519.0,0.34910872190750386,4398.0
peptidyl-threonine phosphorylation (GO:0018107),0.4517049782472112,2520.0,0.48039624260121916,3143.0
hindlimb morphogenesis (GO:0035137),0.4516957019010048,2521.0,0.7406669087522195,903.0
positive regulation of antigen processing and presentation (GO:0002579),0.4515409618919968,2522.5,0.5391715017798895,2431.5
positive regulation of dendritic cell antigen processing and presentation (GO:0002606),0.4515409618919968,2522.5,0.5391715017798895,2431.5
positive regulation of protein polymerization (GO:0032273),0.45135876562454513,2524.0,0.5849697716460299,1915.0
cellular response to growth factor stimulus (GO:0071363),0.45133175338609965,2525.0,0.49216969125293725,2997.0
bile acid and bile salt transport (GO:0015721),0.4513133479023257,2526.0,0.5455325672063187,2342.0
isoprenoid biosynthetic process (GO:0008299),0.4512847636156418,2527.0,0.592982557911088,1837.0
positive regulation of telomere maintenance (GO:0032206),0.4512183075348133,2528.0,0.4742932321710109,3215.0
regulation of cellular protein localization (GO:1903827),0.4512048811737417,2529.0,0.5945744219073418,1821.0
regulation of cholesterol transport (GO:0032374),0.45111294108077193,2530.0,0.4501534189498714,3518.0
regulation of interleukin-12 production (GO:0032655),0.45105330573250485,2531.0,0.5696777645379111,2052.0
cellular response to chemical stress (GO:0062197),0.45104253229210045,2532.0,0.6122354079039336,1693.0
regulation of protein-containing complex disassembly (GO:0043244),0.4509975750437092,2533.0,0.6218155408274562,1621.0
lipid biosynthetic process (GO:0008610),0.4509575740214693,2534.0,0.5653811829519567,2096.0
atrial septum development (GO:0003283),0.4508963980447305,2535.0,0.6653466712476654,1317.0
positive regulation of striated muscle contraction (GO:0045989),0.450755448563742,2536.0,0.45955463025358795,3392.0
regulation of glycoprotein biosynthetic process (GO:0010559),0.45069745421018614,2537.0,0.4973838830851018,2931.0
negative regulation of chemotaxis (GO:0050922),0.45065845438222946,2538.0,0.534566245917037,2496.0
positive regulation of plasma membrane bounded cell projection assembly (GO:0120034),0.45063142788640925,2539.0,0.5047034758490734,2842.0
positive regulation of natural killer cell chemotaxis (GO:2000503),0.4505762174458922,2540.0,0.4271645969029523,3751.0
regulation of cell population proliferation (GO:0042127),0.4504035451206381,2541.0,0.5250767841013768,2604.0
regulation of secretion (GO:0051046),0.45031350354666405,2542.0,0.4565614655682594,3429.0
positive regulation of cytokine production (GO:0001819),0.45030074706478257,2543.0,0.5458734102154101,2336.0
regulation of anion transport (GO:0044070),0.45029033460646783,2544.0,0.484180954304348,3091.0
glycoprotein biosynthetic process (GO:0009101),0.45018062783550233,2545.0,0.5270885266517282,2584.0
peptidyl-tyrosine phosphorylation (GO:0018108),0.450147804327192,2546.0,0.5258851995838438,2599.0
chondrocyte development (GO:0002063),0.45010990912432114,2547.0,0.5928945783828526,1838.0
response to retinoic acid (GO:0032526),0.44997458494711634,2548.0,0.6260141342543627,1592.0
protein localization to cell periphery (GO:1990778),0.4498380913454863,2549.0,0.4551476588202649,3445.0
positive regulation of isomerase activity (GO:0010912),0.449559404333443,2550.0,0.3741416606623585,4237.0
positive regulation of cell projection organization (GO:0031346),0.44929659996902643,2551.0,0.4650024390458958,3336.0
positive regulation of cardiac muscle contraction (GO:0060452),0.44928192435667447,2552.0,0.3534188676006651,4373.0
cytoplasmic microtubule organization (GO:0031122),0.44927205602991976,2553.0,0.6031691529052298,1757.0
phosphatidylinositol-mediated signaling (GO:0048015),0.4491944982151066,2554.0,0.42555556210734063,3766.0
regulation of DNA metabolic process (GO:0051052),0.4491435972665434,2555.0,0.5967056192118595,1801.0
glycoside catabolic process (GO:0016139),0.44900923708059315,2556.0,0.4891554390109101,3035.0
telomere capping (GO:0016233),0.44898054738673226,2557.0,0.5767967205533109,1985.0
positive regulation of protein catabolic process (GO:0045732),0.44895245759626035,2558.0,0.44443724559414266,3579.0
neurogenesis (GO:0022008),0.4489414637275899,2559.0,0.5169400624439487,2702.0
positive regulation of excitatory postsynaptic potential (GO:2000463),0.448835868331339,2560.0,0.546417091463424,2331.0
negative regulation of protein-containing complex assembly (GO:0031333),0.44883389052924316,2561.0,0.5701724540357183,2048.0
positive regulation of production of molecular mediator of immune response (GO:0002702),0.4486915777204879,2562.0,0.5216454126116346,2641.0
adenylate cyclase-inhibiting G protein-coupled receptor signaling pathway (GO:0007193),0.4484627034655078,2563.0,0.5358365708327727,2478.0
energy derivation by oxidation of organic compounds (GO:0015980),0.4484604793205454,2564.0,0.4069175393629057,3943.0
monocyte differentiation (GO:0030224),0.44839114233981264,2565.0,0.5069126115481541,2811.0
positive regulation of protein localization to synapse (GO:1902474),0.4483108864514154,2566.0,0.5486552162668851,2303.0
cholesterol homeostasis (GO:0042632),0.4482178018210724,2567.0,0.5229924750256213,2621.0
hexose transmembrane transport (GO:0008645),0.44820593461360797,2568.0,0.48898080861102505,3037.0
protein localization to chromatin (GO:0071168),0.44813333334606714,2569.0,0.7073665560989156,1071.0
negative regulation of androgen receptor signaling pathway (GO:0060766),0.44806932400445554,2570.0,0.6640512098181512,1329.0
negative regulation of protein serine/threonine kinase activity (GO:0071901),0.4480465846727207,2571.0,0.48119259645617124,3134.0
regulation of osteoblast differentiation (GO:0045667),0.4479194198257807,2572.0,0.5230109157944508,2620.0
modulation of chemical synaptic transmission (GO:0050804),0.44789973024434837,2573.0,0.5219617847292848,2633.0
negative regulation of coagulation (GO:0050819),0.44786923736335416,2574.0,0.4405269317332326,3620.0
microtubule-based transport (GO:0099111),0.44784268548542866,2575.0,0.3309411734812486,4489.0
regulation of regulatory T cell differentiation (GO:0045589),0.447776792359049,2576.0,0.5399357457478263,2425.0
positive regulation of macromolecule biosynthetic process (GO:0010557),0.4477677715767661,2577.0,0.5899707690737833,1869.0
regulation of B cell proliferation (GO:0030888),0.4476911253886866,2578.0,0.5433998882137725,2380.0
negative regulation of leukocyte proliferation (GO:0070664),0.4476464066927326,2579.0,0.45176476607205346,3488.0
organelle fission (GO:0048285),0.4476373241046535,2580.0,0.54766590022804,2312.0
necroptotic process (GO:0070266),0.4472462182776945,2581.0,0.5941227108628588,1826.0
"substrate-dependent cell migration, cell extension (GO:0006930)",0.44713696074830644,2582.0,0.5250376453008012,2605.0
positive regulation of extrinsic apoptotic signaling pathway (GO:2001238),0.4468103316304854,2583.0,0.5142441077878221,2740.0
peptide metabolic process (GO:0006518),0.44666405748221105,2584.0,0.5803307765308139,1953.0
positive regulation of lipid biosynthetic process (GO:0046889),0.4466278336065769,2585.0,0.49413269630029777,2973.0
very long-chain fatty acid metabolic process (GO:0000038),0.44645866516896976,2586.0,0.5190061737973712,2678.0
lipid import into cell (GO:0140354),0.446322020303886,2587.0,0.4207145576040337,3817.0
intrinsic apoptotic signaling pathway by p53 class mediator (GO:0072332),0.4463061019360861,2588.0,0.4512321632388777,3497.0
negative regulation of cell-substrate adhesion (GO:0010812),0.4463046820282264,2589.0,0.4640892501209554,3350.0
regulation of phosphatidylinositol 3-kinase signaling (GO:0014066),0.44622054998302757,2590.0,0.5067123358417621,2816.0
protein O-linked glycosylation (GO:0006493),0.4459910847256554,2591.0,0.5797315536766138,1957.0
neuron development (GO:0048666),0.44598605654922335,2592.0,0.46885998841358756,3275.0
sterol homeostasis (GO:0055092),0.4458830768070397,2593.0,0.5236601785001463,2616.0
positive regulation of Notch signaling pathway (GO:0045747),0.4458722858341998,2594.0,0.5416019680999663,2408.0
cell morphogenesis involved in differentiation (GO:0000904),0.44579580733788277,2595.0,0.4920051587356533,3003.0
regulation of transcription from RNA polymerase II promoter involved in myocardial precursor cell differentiation (GO:0003256),0.44575341410933933,2596.0,0.5565164327911976,2208.0
membrane depolarization during cardiac muscle cell action potential (GO:0086012),0.4457216462982918,2597.0,0.48930027561712514,3033.0
purine nucleotide catabolic process (GO:0006195),0.4453116659499473,2598.5,0.948470521742452,311.5
purine-containing compound catabolic process (GO:0072523),0.4453116659499473,2598.5,0.948470521742452,311.5
protein homotetramerization (GO:0051289),0.4452443801554135,2600.0,0.5749050989630151,2011.0
molybdopterin cofactor biosynthetic process (GO:0032324),0.4452131070628445,2601.0,0.3496487442368676,4396.0
cellular response to organic cyclic compound (GO:0071407),0.44500781192263267,2602.0,0.4937420766041009,2979.0
vasculogenesis (GO:0001570),0.4449295496612421,2603.0,0.5065155142330937,2819.0
regulation of axonogenesis (GO:0050770),0.4449187634062971,2604.0,0.47187824904244835,3246.0
chemical homeostasis (GO:0048878),0.4448349561890738,2605.0,0.6267740821371627,1586.0
chromatin maintenance (GO:0070827),0.44482008319390487,2606.0,0.6816077034489734,1211.0
regulation of GTPase activity (GO:0043087),0.44470790572101704,2607.0,0.5228597094660055,2623.0
T cell activation (GO:0042110),0.4446958912067025,2608.0,0.5520461899939546,2260.0
response to molecule of bacterial origin (GO:0002237),0.44468079750350237,2609.0,0.536907455818912,2467.0
retinoic acid metabolic process (GO:0042573),0.44466283935561063,2610.0,0.3171720991899897,4568.0
positive regulation of leukocyte mediated cytotoxicity (GO:0001912),0.44452661076376304,2611.0,0.5658297948283142,2093.0
toll-like receptor signaling pathway (GO:0002224),0.444491919742433,2612.0,0.5091049540502804,2789.0
regulation of immunoglobulin production (GO:0002637),0.4444562920389333,2613.0,0.5035765048582627,2849.0
carboxylic acid transmembrane transport (GO:1905039),0.44444925818681347,2614.0,0.45946132514709875,3395.0
GTP metabolic process (GO:0046039),0.44436414115020606,2615.0,0.5795160336917686,1961.0
phosphatidylethanolamine acyl-chain remodeling (GO:0036152),0.44421486196511334,2616.0,0.5491268690486646,2296.0
aortic valve morphogenesis (GO:0003180),0.44412319303415576,2617.0,0.47430118298509677,3214.0
regulation of mitochondrial membrane potential (GO:0051881),0.44403108601560515,2618.0,0.6678143185190422,1294.0
regulation of protein phosphorylation (GO:0001932),0.4439387548586145,2619.0,0.5132015733103753,2755.0
positive regulation of epidermal growth factor receptor signaling pathway (GO:0045742),0.44393597385154576,2620.0,0.613994178069494,1676.0
fatty acid catabolic process (GO:0009062),0.4439294919621889,2621.0,0.4518899466821236,3486.0
negative regulation of adaptive immune response (GO:0002820),0.4439049203933983,2622.0,0.45399445538233146,3462.0
cholesterol metabolic process (GO:0008203),0.4438743609291764,2623.0,0.5077653127846152,2804.0
myeloid cell activation involved in immune response (GO:0002275),0.4435582780958778,2624.0,0.4633901446535344,3355.0
microtubule polymerization (GO:0046785),0.4434897428386389,2625.0,0.6363879593163411,1515.0
salivary gland development (GO:0007431),0.44340528016964176,2626.0,0.5190513812613802,2677.0
regulation of plasma membrane bounded cell projection assembly (GO:0120032),0.44325394765511944,2627.0,0.5651768031865747,2099.0
cAMP metabolic process (GO:0046058),0.44307942412005413,2628.0,0.43771029544560547,3647.0
cortical cytoskeleton organization (GO:0030865),0.4429882357364894,2629.0,0.4473155421213518,3544.0
melanosome transport (GO:0032402),0.44291576901644064,2631.5,0.3857294497943933,4146.5
melanosome localization (GO:0032400),0.44291576901644064,2631.5,0.3857294497943933,4146.5
establishment of melanosome localization (GO:0032401),0.44291576901644064,2631.5,0.3857294497943933,4146.5
pigment granule transport (GO:0051904),0.44291576901644064,2631.5,0.3857294497943933,4146.5
regulation of short-term neuronal synaptic plasticity (GO:0048172),0.4426184715170807,2634.0,0.4528655555770386,3475.0
digestive tract morphogenesis (GO:0048546),0.44259348620714717,2635.0,0.6109655285789359,1703.0
regulation of mitochondrial membrane permeability (GO:0046902),0.4425061267832652,2636.0,0.5448905252312879,2346.0
negative regulation of macrophage migration (GO:1905522),0.44245479857606357,2637.0,0.4774080205838241,3179.0
positive regulation of store-operated calcium channel activity (GO:1901341),0.4423886744181738,2638.0,0.8518159212898064,524.0
skeletal system development (GO:0001501),0.4423008069982355,2639.0,0.5361208973568633,2474.0
negative regulation of protein modification by small protein conjugation or removal (GO:1903321),0.4421579824850924,2640.0,0.5616066970927923,2152.0
positive regulation of protein maturation (GO:1903319),0.4420254266437434,2641.0,0.6612196128419403,1347.0
mesenchymal to epithelial transition involved in metanephros morphogenesis (GO:0003337),0.4420237653634702,2642.0,0.8952098790074614,414.0
negative regulation of cellular process (GO:0048523),0.4418866426174979,2643.0,0.5085306280554344,2794.0
regulation of cellular component movement (GO:0051270),0.4417107600950114,2644.0,0.5374214242437827,2460.0
sarcomere organization (GO:0045214),0.4415937778031925,2645.0,0.4553487261235801,3441.0
peptidyl-S-diacylglycerol-L-cysteine biosynthetic process from peptidyl-cysteine (GO:0018231),0.44153388726730974,2646.5,0.6709964053244459,1272.5
peptidyl-L-cysteine S-palmitoylation (GO:0018230),0.44153388726730974,2646.5,0.6709964053244459,1272.5
spinal cord dorsal/ventral patterning (GO:0021513),0.44143095333007903,2648.0,0.5105932747955763,2773.0
tyrosine phosphorylation of STAT protein (GO:0007260),0.4413830245811846,2649.0,0.6506973517496075,1423.0
regulation of aerobic respiration (GO:1903715),0.44132585594137336,2650.0,0.5878708500112614,1889.0
positive regulation of Ras protein signal transduction (GO:0046579),0.4412036040169951,2651.0,0.5921195218250894,1847.0
fatty acid beta-oxidation (GO:0006635),0.44117901757934225,2652.0,0.5375399078879244,2458.0
histone H3-K4 trimethylation (GO:0080182),0.4410277932963945,2653.0,0.5885621974881978,1879.0
positive regulation of I-kappaB kinase/NF-kappaB signaling (GO:0043123),0.44095451629175103,2654.0,0.5087248427773826,2792.0
dendritic spine morphogenesis (GO:0060997),0.4409166529317868,2655.0,0.5774785879266675,1978.0
regulation of tube diameter (GO:0035296),0.44090859295794527,2656.5,0.48567059848754185,3074.5
vascular process in circulatory system (GO:0003018),0.44090859295794527,2656.5,0.48567059848754185,3074.5
response to estradiol (GO:0032355),0.44084111893789285,2658.0,0.621265691383424,1624.0
positive regulation of synapse assembly (GO:0051965),0.44082755393130074,2659.0,0.5226899920857359,2625.0
regulation of macroautophagy (GO:0016241),0.4408033837279806,2660.0,0.5287996388799366,2564.0
gastrulation with mouth forming second (GO:0001702),0.4407930995865062,2661.0,0.5544935197284943,2236.0
actin filament organization (GO:0007015),0.44062490412986444,2662.0,0.4857502732733169,3073.0
negative regulation of macrophage derived foam cell differentiation (GO:0010745),0.4404881625195792,2663.0,0.4513833411393036,3494.0
photoperiodism (GO:0009648),0.44046038209602306,2664.0,0.5430877642738572,2386.0
organic acid transport (GO:0015849),0.4404047909551698,2665.0,0.5140977688273027,2742.0
cellular response to hormone stimulus (GO:0032870),0.4403121135676386,2666.0,0.44723947368723244,3545.0
secondary alcohol metabolic process (GO:1902652),0.44013646392515743,2667.0,0.44635868001958867,3555.0
positive regulation of actin nucleation (GO:0051127),0.4401208701622488,2668.0,0.293822467832036,4678.0
striated muscle tissue development (GO:0014706),0.4400412972234182,2669.0,0.5509100777934656,2278.0
cGMP-mediated signaling (GO:0019934),0.43998619844913595,2670.0,0.4447287042794677,3575.0
bicarbonate transport (GO:0015701),0.4399698150193353,2671.0,0.5067420468465865,2815.0
rRNA transcription (GO:0009303),0.4398610975068173,2672.0,0.694676238739243,1129.0
anterograde trans-synaptic signaling (GO:0098916),0.43981364179749866,2673.0,0.5214659381489295,2642.0
regulation of toll-like receptor 9 signaling pathway (GO:0034163),0.4397742189890391,2674.0,0.8512231390428002,525.0
peptidyl-threonine modification (GO:0018210),0.4397643462849204,2675.0,0.49762532705119256,2924.0
membrane lipid metabolic process (GO:0006643),0.43975271957101464,2676.0,0.6649407019827438,1320.0
long-term synaptic potentiation (GO:0060291),0.4396779978314476,2677.0,0.5390017747934117,2437.0
regulation of B cell activation (GO:0050864),0.43960328423245687,2678.0,0.47025351315385266,3263.0
mammary gland epithelium development (GO:0061180),0.4395872107657721,2679.0,0.5189431721320098,2679.0
membrane protein intracellular domain proteolysis (GO:0031293),0.4395270046136882,2680.0,0.5961055952167101,1806.0
regulation of TOR signaling (GO:0032006),0.4393998240352539,2681.0,0.5158295966600958,2715.0
regulation of histone deacetylase activity (GO:1901725),0.4393785483573365,2682.0,0.3844141381202528,4155.0
negative regulation of macrophage chemotaxis (GO:0010760),0.4393080103657631,2683.0,0.4849286403466552,3080.0
chemical synaptic transmission (GO:0007268),0.43926801082907196,2684.0,0.5275214737603046,2580.0
glycosaminoglycan metabolic process (GO:0030203),0.43920362514707323,2685.0,0.5465247506144597,2328.0
positive regulation of GTPase activity (GO:0043547),0.43892650815973167,2686.0,0.5025542915799629,2863.0
regulation of proteasomal protein catabolic process (GO:0061136),0.4388839014187845,2687.0,0.6878238346676074,1173.0
axon extension involved in axon guidance (GO:0048846),0.43888220083510837,2688.5,0.4182991081632127,3842.5
neuron projection extension involved in neuron projection guidance (GO:1902284),0.43888220083510837,2688.5,0.4182991081632127,3842.5
positive regulation of cytokine-mediated signaling pathway (GO:0001961),0.4388240794652809,2690.0,0.4594320554810049,3396.0
intrinsic apoptotic signaling pathway (GO:0097193),0.4387719449582015,2691.0,0.5211870865018661,2647.0
regulation of actin filament polymerization (GO:0030833),0.4387588557281559,2692.0,0.4812017490734544,3133.0
negative regulation of cellular carbohydrate metabolic process (GO:0010677),0.4386954052481336,2693.0,0.4390562949841138,3632.0
phosphatidylinositol 3-kinase signaling (GO:0014065),0.4386828409193359,2694.0,0.4123303358475004,3898.0
brain morphogenesis (GO:0048854),0.4385946581063895,2695.0,0.5051414160798965,2835.0
negative regulation of kinase activity (GO:0033673),0.43835248859536935,2696.0,0.6769381704779827,1240.0
cardiac pacemaker cell development (GO:0060926),0.43825101224606444,2697.0,0.4129596380837086,3890.0
negative regulation of lipid metabolic process (GO:0045833),0.4382454167700819,2698.0,0.4139906377871777,3882.0
long-chain fatty acid biosynthetic process (GO:0042759),0.43821685451205566,2699.0,0.7137716559601944,1039.0
negative regulation of protein processing (GO:0010955),0.43817840342630165,2700.0,0.36872422991045045,4277.0
MyD88-dependent toll-like receptor signaling pathway (GO:0002755),0.43814737172866247,2701.0,0.5511475287091646,2276.0
response to tumor necrosis factor (GO:0034612),0.4380521304657286,2702.0,0.49314867079749786,2987.0
regulation of I-kappaB kinase/NF-kappaB signaling (GO:0043122),0.43801701052436437,2703.0,0.4961204833904883,2949.0
positive regulation of cell junction assembly (GO:1901890),0.4380158413732345,2704.0,0.4405870440644864,3619.0
regulation of sequestering of triglyceride (GO:0010889),0.43773707048862887,2705.0,0.5452611431302488,2345.0
regulation of ERK1 and ERK2 cascade (GO:0070372),0.4374357188552519,2706.0,0.5269880159209686,2587.0
regulated exocytosis (GO:0045055),0.43736000023952587,2707.0,0.4590855245061116,3401.0
positive regulation of protein dephosphorylation (GO:0035307),0.43732118684417787,2708.0,0.5378675921347162,2452.0
regulation of fibroblast growth factor receptor signaling pathway (GO:0040036),0.4372777828146763,2709.0,0.4899141524926308,3025.0
C21-steroid hormone metabolic process (GO:0008207),0.4372273825458856,2710.0,0.5057893259588523,2829.0
positive regulation of phospholipase A2 activity (GO:0032430),0.4371571454965876,2711.0,0.46747148202263666,3300.0
regulation of gene expression (GO:0010468),0.4370972192244373,2712.0,0.5350419671477524,2488.0
axonemal dynein complex assembly (GO:0070286),0.4370638062283233,2713.0,0.37871110178335904,4190.0
isoprenoid metabolic process (GO:0006720),0.43705959534491406,2714.0,0.517447491139696,2693.0
toxin transport (GO:1901998),0.4370538553016766,2715.0,0.48505959032884255,3079.0
positive regulation of fatty acid metabolic process (GO:0045923),0.43697235904537485,2716.0,0.4231970607792147,3791.0
cobalamin transport (GO:0015889),0.43694124452945504,2717.0,0.5810699181943417,1944.0
regulation of glucose metabolic process (GO:0010906),0.43685958600943897,2718.0,0.39631504173864807,4059.0
protein processing (GO:0016485),0.43667479169697426,2719.0,0.5438561462451756,2371.0
negative regulation of response to external stimulus (GO:0032102),0.4366368575406158,2720.0,0.5284709114191406,2567.0
negative regulation of cardiac muscle cell proliferation (GO:0060044),0.4366290491886212,2721.0,0.32305834010159945,4540.0
regulation of transmembrane transporter activity (GO:0022898),0.4364201407268952,2722.0,0.6262147625424964,1591.0
regulation of DNA damage checkpoint (GO:2000001),0.43625965538972294,2723.0,0.6514202370474577,1414.0
