set,Real_Score,Real_Rank,Syn_Score,Syn_Rank
"DNA replication, synthesis of RNA primer (GO:0006269)",1.7204056926289202,1.0,1.9549610608802972,1.0
DNA strand elongation involved in DNA replication (GO:0006271),1.58384509702313,2.0,1.7796763034716694,10.0
nucleobase biosynthetic process (GO:0046112),1.5762538719797565,3.0,1.6798053941271718,16.0
mitotic DNA replication (GO:1902969),1.5722588545009397,4.0,1.8170522019514455,2.0
nuclear RNA surveillance (GO:0071027),1.5109575781454936,5.0,1.6204183162435413,18.0
ribonucleoside monophosphate biosynthetic process (GO:0009156),1.497883613256377,6.5,1.6072864691972994,20.5
purine nucleoside monophosphate biosynthetic process (GO:0009127),1.497883613256377,6.5,1.6072864691972994,20.5
sno(s)RNA 3'-end processing (GO:0031126),1.440289751791851,8.0,1.75117335488397,11.0
ribose phosphate metabolic process (GO:0019693),1.4163296524761342,9.0,1.508842261133067,22.0
DNA strand elongation (GO:0022616),1.4143431953268348,10.0,1.7283489538443795,15.0
rRNA 3'-end processing (GO:0031125),1.4086099542306123,11.0,1.731582270245725,14.0
U4 snRNA 3'-end processing (GO:0034475),1.3867244503971627,12.0,1.6165246953253283,19.0
RNA localization to Cajal body (GO:0090670),1.3659343791790295,13.5,1.8059263858754981,3.5
scaRNA localization to Cajal body (GO:0090666),1.3659343791790295,13.5,1.8059263858754981,3.5
establishment of protein localization to chromosome (GO:0070199),1.3318687006766738,15.0,1.455335426473182,26.0
positive regulation of telomerase RNA localization to Cajal body (GO:1904874),1.3197574756303327,16.5,1.7368608041685079,12.5
regulation of telomerase RNA localization to Cajal body (GO:1904872),1.3197574756303327,16.5,1.7368608041685079,12.5
regulation of establishment of protein localization to telomere (GO:0070203),1.3100825511698941,20.0,1.7881647368984588,7.0
"positive regulation of protein localization to chromosome, telomeric region (GO:1904816)",1.3100825511698941,20.0,1.7881647368984588,7.0
positive regulation of establishment of protein localization to telomere (GO:1904851),1.3100825511698941,20.0,1.7881647368984588,7.0
positive regulation of protein localization to Cajal body (GO:1904871),1.3100825511698941,20.0,1.7881647368984588,7.0
regulation of protein localization to Cajal body (GO:1904869),1.3100825511698941,20.0,1.7881647368984588,7.0
telomeric D-loop disassembly (GO:0061820),1.3010625605360486,23.0,1.2378655528876334,69.0
chromatin remodeling at centromere (GO:0031055),1.2999670192626136,24.0,1.343995488055788,36.0
positive regulation of establishment of protein localization (GO:1904951),1.286305336053137,25.0,1.6430919284127092,17.0
regulation of transcription involved in G1/S transition of mitotic cell cycle (GO:0000083),1.2709459864522803,26.0,1.2843467726500322,55.0
CENP-A containing nucleosome assembly (GO:0034080),1.2701172027823973,27.5,1.2716351029241737,59.5
CENP-A containing chromatin organization (GO:0061641),1.2701172027823973,27.5,1.2716351029241737,59.5
centromere complex assembly (GO:0034508),1.2696251719123797,29.0,1.331666200236584,39.0
negative regulation of mitotic metaphase/anaphase transition (GO:0045841),1.2450695355900239,30.0,1.3448344326039754,35.0
positive regulation of DNA-dependent DNA replication (GO:2000105),1.2392094280568398,31.0,1.4430358019836302,27.0
kinetochore organization (GO:0051383),1.23373172218147,32.0,1.3663277254834427,34.0
mitotic spindle assembly checkpoint signaling (GO:0007094),1.232121962570042,34.0,1.3194039084382905,41.0
spindle assembly checkpoint signaling (GO:0071173),1.232121962570042,34.0,1.3194039084382905,41.0
mitotic spindle checkpoint signaling (GO:0071174),1.232121962570042,34.0,1.3194039084382905,41.0
nucleocytoplasmic transport (GO:0006913),1.2311816567044005,36.0,1.2870488396175905,54.0
glutamine transport (GO:0006868),1.2167809821964106,37.0,1.4717688487081293,25.0
"endonucleolytic cleavage in ITS1 to separate SSU-rRNA from 5.8S rRNA and LSU-rRNA from tricistronic rRNA transcript (SSU-rRNA, 5.8S rRNA, LSU-rRNA) (GO:0000447)",1.212640349083872,38.0,1.370830584685661,33.0
negative regulation of meiotic cell cycle (GO:0051447),1.2051785758074813,39.0,1.2028461273322753,77.0
histone mRNA metabolic process (GO:0008334),1.1950314086166771,40.0,1.3051585672787067,44.0
hepatocyte differentiation (GO:0070365),1.1904559473160263,41.0,1.1337789761651484,109.0
cristae formation (GO:0042407),1.1868338068936293,42.0,1.2373438188627746,70.0
nuclear transport (GO:0051169),1.1848139155077133,43.0,1.3021747565273314,46.0
polyadenylation-dependent snoRNA 3'-end processing (GO:0071051),1.1841309222310736,44.0,1.4392871969815093,28.0
DNA replication initiation (GO:0006270),1.1789270689730595,45.0,1.2216922965387078,74.0
tetrahydrofolate metabolic process (GO:0046653),1.1776699306005278,46.5,1.379199987965105,31.5
tetrahydrofolate interconversion (GO:0035999),1.1776699306005278,46.5,1.379199987965105,31.5
chromatin silencing at telomere (GO:0006348),1.173981406587903,48.0,1.0388110834162874,191.0
mitotic spindle elongation (GO:0000022),1.1732737857576512,49.5,1.1135060062191613,123.5
mitotic spindle midzone assembly (GO:0051256),1.1732737857576512,49.5,1.1135060062191613,123.5
kinetochore assembly (GO:0051382),1.1684856807449335,51.0,1.29056857417257,52.0
purine nucleobase metabolic process (GO:0006144),1.1645656987710686,52.0,1.26326587090745,62.0
"nuclear-transcribed mRNA catabolic process, exonucleolytic, 3'-5' (GO:0034427)",1.1639214458999891,53.0,1.295990339019401,51.0
pyrimidine ribonucleotide biosynthetic process (GO:0009220),1.1503743163602487,54.5,1.2020529865315366,78.5
pyrimidine nucleobase biosynthetic process (GO:0019856),1.1503743163602487,54.5,1.2020529865315366,78.5
replication fork protection (GO:0048478),1.1478110393089924,56.0,1.2704698913588877,61.0
nuclear mRNA surveillance (GO:0071028),1.1474437879605182,57.0,1.3080917955590035,43.0
mitotic sister chromatid cohesion (GO:0007064),1.1452034098612056,58.0,1.3860874921076973,30.0
DNA replication-independent nucleosome assembly (GO:0006336),1.137996959913813,59.0,1.2370879592383506,71.0
amino-acid betaine transport (GO:0015838),1.133261325899739,60.0,0.9398846247735194,324.0
positive regulation of stem cell proliferation (GO:2000648),1.1310013299483006,61.0,0.8312582996345914,585.0
ribose phosphate biosynthetic process (GO:0046390),1.1269427566817805,62.0,1.0174807632428648,219.0
peptidyl-lysine dimethylation (GO:0018027),1.1232422369812296,63.0,1.0587516150266525,175.0
regulation of sister chromatid cohesion (GO:0007063),1.1210281569177025,64.0,1.339694263668535,37.0
protein localization to microtubule cytoskeleton (GO:0072698),1.1188676121612742,65.0,1.2743213443744386,57.0
"maturation of 5.8S rRNA from tricistronic rRNA transcript (SSU-rRNA, 5.8S rRNA, LSU-rRNA) (GO:0000466)",1.11005440074461,66.0,1.2890489455196932,53.0
"maturation of SSU-rRNA from tricistronic rRNA transcript (SSU-rRNA, 5.8S rRNA, LSU-rRNA) (GO:0000462)",1.1078076994538941,67.0,1.1986943595247248,80.0
regulation of acetyl-CoA biosynthetic process from pyruvate (GO:0010510),1.1061864478456325,68.5,1.1068153965893335,129.5
regulation of acyl-CoA biosynthetic process (GO:0050812),1.1061864478456325,68.5,1.1068153965893335,129.5
myelin assembly (GO:0032288),1.0953640208912805,70.0,1.2416593817274795,67.0
regulation of spindle organization (GO:0090224),1.093962367602995,71.0,1.1208419000746723,117.0
DNA replication-dependent nucleosome assembly (GO:0006335),1.0896763729925074,72.5,1.3019945781835587,47.5
DNA replication-dependent nucleosome organization (GO:0034723),1.0896763729925074,72.5,1.3019945781835587,47.5
rRNA modification (GO:0000154),1.077270811477009,74.0,1.3010034518110831,49.0
mitochondrial calcium ion transmembrane transport (GO:0006851),1.0760876557984331,75.0,1.3349555281526515,38.0
pyrimidine-containing compound metabolic process (GO:0072527),1.0745613109799963,76.0,1.1138775184600151,122.0
mitochondrial gene expression (GO:0140053),1.0658469406479576,77.0,1.1679251002869737,89.0
cerebral cortex neuron differentiation (GO:0021895),1.0642787731044951,78.0,1.2314064145826886,73.0
DNA ligation (GO:0006266),1.0596878783822954,79.0,1.1922529084775881,81.0
chromosome condensation (GO:0030261),1.0579584242350732,80.0,1.1581403330819662,97.0
protein K29-linked ubiquitination (GO:0035519),1.05794918162521,81.0,1.113941048622027,121.0
pyrimidine-containing compound biosynthetic process (GO:0072528),1.054899712046437,82.0,1.0655648033486007,166.0
regulation of mitotic sister chromatid separation (GO:0010965),1.0513912695457108,83.0,1.0380812741909318,194.0
negative regulation of microtubule depolymerization (GO:0007026),1.0496998575309535,84.0,1.084447959796038,146.0
termination of RNA polymerase II transcription (GO:0006369),1.0458423776059114,85.0,1.1270534617476062,112.0
negative regulation of DNA-dependent DNA replication (GO:2000104),1.0434328569785676,86.0,1.1614713544165214,93.0
telomeric loop disassembly (GO:0090657),1.0356854860537998,87.0,1.000205127672849,233.0
G-quadruplex DNA unwinding (GO:0044806),1.0352936662696666,88.0,1.2112281085618752,76.0
serine transport (GO:0032329),1.0338012557017835,89.0,1.095926360606764,135.0
regulation of DNA-directed DNA polymerase activity (GO:1900262),1.0299070488843505,90.5,1.2537642069243564,63.5
positive regulation of DNA-directed DNA polymerase activity (GO:1900264),1.0299070488843505,90.5,1.2537642069243564,63.5
enzyme-directed rRNA pseudouridine synthesis (GO:0000455),1.0289358524351773,92.5,1.4774589466461834,23.5
rRNA pseudouridine synthesis (GO:0031118),1.0289358524351773,92.5,1.4774589466461834,23.5
carnitine transport (GO:0015879),1.027291484335628,94.0,0.895315131907194,413.0
V(D)J recombination (GO:0033151),1.0257795141766035,95.0,1.1328970550111714,110.0
positive regulation of neuron migration (GO:2001224),1.0254123805022293,96.0,1.1212492491590205,116.0
mitotic chromosome condensation (GO:0007076),1.0240804059276662,97.0,1.017377224979615,220.0
mitotic DNA integrity checkpoint signaling (GO:0044774),1.0240500569809068,98.0,1.112889652138429,125.0
protein import into mitochondrial matrix (GO:0030150),1.0194290626143823,99.0,1.1603324449120982,94.0
regulation of DNA-dependent DNA replication (GO:0090329),1.0172510868433544,100.0,1.0839153505501236,147.0
5-phosphoribose 1-diphosphate metabolic process (GO:0046391),1.0126645349247563,101.5,0.7746706372217188,756.5
5-phosphoribose 1-diphosphate biosynthetic process (GO:0006015),1.0126645349247563,101.5,0.7746706372217188,756.5
spliceosomal snRNP assembly (GO:0000387),1.0113879548261206,103.0,1.1034058226653392,133.0
microtubule cytoskeleton organization involved in mitosis (GO:1902850),1.007787968295682,104.0,1.0898173532431115,143.0
histone exchange (GO:0043486),1.0068184863972403,105.0,1.0073661914302376,223.0
negative regulation of telomere maintenance via telomere lengthening (GO:1904357),1.004408237392663,106.0,0.9399389655730429,323.0
microtubule depolymerization (GO:0007019),1.0033070757172984,107.0,1.023694247287202,210.0
histone phosphorylation (GO:0016572),0.9952931420868748,108.0,1.1601280077118883,95.0
regulation of vesicle fusion (GO:0031338),0.991815162469615,109.0,0.889342148030733,431.0
nephron tubule development (GO:0072080),0.9897086807778945,110.0,0.9511205498801459,306.0
negative regulation of chromosome organization (GO:2001251),0.9889911542403075,111.0,0.7668086617078963,790.0
negative regulation of intrinsic apoptotic signaling pathway in response to DNA damage by p53 class mediator (GO:1902166),0.9884372777826199,112.0,1.2736650116610087,58.0
attachment of mitotic spindle microtubules to kinetochore (GO:0051315),0.9863212212070147,113.0,1.1268800211532877,114.0
pyrimidine nucleoside biosynthetic process (GO:0046134),0.9836175368915501,114.0,0.9512769679110369,305.0
stress-activated protein kinase signaling cascade (GO:0031098),0.9787662180998862,115.0,1.01912155360641,215.0
mitotic spindle organization (GO:0007052),0.9748203493966169,116.0,1.0720219013863412,159.0
regulation of protein kinase A signaling (GO:0010738),0.9745285874813377,117.0,0.9187098036381749,371.0
mitochondrial translational termination (GO:0070126),0.9690577598294744,118.0,1.175674499931087,85.0
positive regulation of viral transcription (GO:0050434),0.9665767245806741,119.0,1.217664788026616,75.0
DNA alkylation (GO:0006305),0.9644306964280921,120.5,1.0726235871153367,156.5
DNA methylation or demethylation (GO:0044728),0.9644306964280921,120.5,1.0726235871153367,156.5
histone-serine phosphorylation (GO:0035404),0.9617523071935135,122.0,0.8776712634464522,458.0
lysosomal microautophagy (GO:0016237),0.9611992934848158,123.5,1.0182034456539564,217.5
piecemeal microautophagy of the nucleus (GO:0034727),0.9611992934848158,123.5,1.0182034456539564,217.5
regulation of protein K63-linked ubiquitination (GO:1900044),0.9537856737458172,125.0,0.9342579122649453,335.0
RNA stabilization (GO:0043489),0.9504399792947368,126.0,1.1046107361316568,131.0
leucine catabolic process (GO:0006552),0.9497868129367311,127.5,0.9763384895873847,261.5
leucine metabolic process (GO:0006551),0.9497868129367311,127.5,0.9763384895873847,261.5
establishment of protein localization to mitochondrion (GO:0072655),0.9481661248828899,129.0,1.0255822552294747,209.0
nucleotide biosynthetic process (GO:0009165),0.9480197296253804,130.0,0.9670937107045692,274.0
mitochondrial translational elongation (GO:0070125),0.9471409655061498,131.0,1.1677185199222762,90.0
translational termination (GO:0006415),0.9446656568533396,132.0,1.1676680918636866,91.0
endoplasmic reticulum tubular network organization (GO:0071786),0.9420292511872355,133.0,0.8707855300545584,469.0
anterograde axonal protein transport (GO:0099641),0.9416137661636388,135.0,1.081404144338217,150.0
protein localization to presynapse (GO:1905383),0.9416137661636388,135.0,1.081404144338217,150.0
axo-dendritic protein transport (GO:0099640),0.9416137661636388,135.0,1.081404144338217,150.0
nuclear pore complex assembly (GO:0051292),0.9393609969454497,137.0,1.0727783616901045,154.0
regulation of DNA recombination at telomere (GO:0072695),0.9390602929940024,138.5,1.1377805373208643,104.5
negative regulation of DNA recombination at telomere (GO:0048239),0.9390602929940024,138.5,1.1377805373208643,104.5
reticulophagy (GO:0061709),0.9370635265005829,140.0,0.9075433434930739,392.0
"endonucleolytic cleavage of tricistronic rRNA transcript (SSU-rRNA, 5.8S rRNA, LSU-rRNA) (GO:0000479)",0.9366347136799437,141.0,1.1499189167593191,101.0
translational elongation (GO:0006414),0.9343460111321897,142.0,1.154243838349913,100.0
protein insertion into mitochondrial inner membrane (GO:0045039),0.934077176939801,143.0,0.9674831602850665,273.0
membrane biogenesis (GO:0044091),0.9324736149366438,144.0,1.084609960990852,145.0
mitotic DNA replication checkpoint signaling (GO:0033314),0.9323777055905389,145.0,1.0374183350208228,195.0
GDP-mannose metabolic process (GO:0019673),0.9318659895949559,146.0,0.9614862522363397,286.0
neuron remodeling (GO:0016322),0.9312828806705788,147.0,0.7909858551473132,704.0
retrograde axonal transport (GO:0008090),0.9293720148173094,148.0,0.8927720572542344,421.0
negative regulation of chemokine-mediated signaling pathway (GO:0070100),0.9281694420332446,149.0,0.9312181919820118,341.0
meiotic sister chromatid cohesion (GO:0051177),0.9280564057945586,150.0,1.0202332797096494,213.0
purine ribonucleoside monophosphate biosynthetic process (GO:0009168),0.9270558473553444,151.0,1.1145250374524645,120.0
organic cation transport (GO:0015695),0.9251212181514786,152.0,0.8632209682172054,494.0
protein K6-linked ubiquitination (GO:0085020),0.9250481044533416,153.0,0.9710746123306737,266.0
positive regulation of vesicle fusion (GO:0031340),0.9244823898249107,154.0,1.0203739810465275,212.0
response to X-ray (GO:0010165),0.9212449947551946,155.0,1.053462294803492,178.0
purine ribonucleoside monophosphate metabolic process (GO:0009167),0.9211257409884466,156.0,1.0914852068536982,138.0
mitochondrial RNA processing (GO:0000963),0.9210842512216924,157.0,1.0433440277238335,187.0
mitotic G2 DNA damage checkpoint signaling (GO:0007095),0.9189929781873558,158.0,0.9780269141564185,257.0
regulation of cytochrome-c oxidase activity (GO:1904959),0.9189158616136547,159.0,1.1670631765389647,92.0
mitochondrial translation (GO:0032543),0.9187794600760956,160.0,1.1342388594525854,108.0
protein lipoylation (GO:0009249),0.9183595847239655,161.0,1.2317956558771035,72.0
inner mitochondrial membrane organization (GO:0007007),0.9179636304918299,162.0,0.9611923725344977,287.0
monoamine transport (GO:0015844),0.9167594345436934,163.0,1.0078317439823958,222.0
DNA modification (GO:0006304),0.9158560559273593,164.0,0.9595897121998188,289.0
"negative regulation of blood coagulation, intrinsic pathway (GO:2000267)",0.9156693138251817,165.5,0.8961406668991246,409.5
"regulation of blood coagulation, intrinsic pathway (GO:2000266)",0.9156693138251817,165.5,0.8961406668991246,409.5
dopamine transport (GO:0015872),0.9150334704096124,167.0,0.9560024493943844,297.0
maturation of SSU-rRNA (GO:0030490),0.9149495637596199,168.0,1.0521365292709721,179.0
pyrimidine-containing compound salvage (GO:0008655),0.9137466356852793,169.5,0.7969885443003443,676.5
pyrimidine nucleoside salvage (GO:0043097),0.9137466356852793,169.5,0.7969885443003443,676.5
magnesium ion homeostasis (GO:0010960),0.9101351990451843,171.0,0.8290144165102161,591.0
positive regulation of double-strand break repair via homologous recombination (GO:1905168),0.9099927620988604,172.0,0.837290599788618,564.0
tRNA aminoacylation (GO:0043039),0.9097275336879159,173.0,1.1318564404141198,111.0
DNA replication (GO:0006260),0.9095587248685543,174.0,0.989032852974267,249.0
error-prone translesion synthesis (GO:0042276),0.9094341043496618,175.0,0.9774336064318764,260.0
neuron maturation (GO:0042551),0.9075601379467189,176.0,0.8080692556076043,646.0
tubulin complex assembly (GO:0007021),0.9075382394006999,177.0,1.3009988117224738,50.0
DNA replication checkpoint signaling (GO:0000076),0.9051070342714003,178.0,0.9761903326024409,263.0
pyrimidine nucleoside metabolic process (GO:0006213),0.9044088638027366,179.0,1.078663059722734,152.0
negative regulation of cellular respiration (GO:1901856),0.904372916603438,180.0,0.8420697408095098,545.0
T cell apoptotic process (GO:0070231),0.9040630082856671,181.0,1.2838035419668383,56.0
coenzyme A metabolic process (GO:0015936),0.9040110419425981,182.0,0.9828499939056173,254.0
"RNA phosphodiester bond hydrolysis, endonucleolytic (GO:0090502)",0.903999010711304,183.0,0.9496406115521463,309.0
negative regulation of cytokinesis (GO:0032466),0.9037203271635829,184.0,1.0000376382210234,235.0
import into nucleus (GO:0051170),0.9027842440792267,185.0,0.9813171276022635,255.0
regulation of chromatin organization (GO:1902275),0.9024855613277046,186.0,1.0626586393943402,170.0
regulation of gene silencing by RNA (GO:0060966),0.9015427826358594,187.5,1.1353406922606235,106.5
regulation of posttranscriptional gene silencing (GO:0060147),0.9015427826358594,187.5,1.1353406922606235,106.5
positive regulation of extracellular matrix assembly (GO:1901203),0.9013470556629603,189.0,1.0726166546972944,158.0
DNA replication-independent nucleosome organization (GO:0034724),0.9001805227503613,190.0,1.1749031006038695,87.0
regulation of metaphase/anaphase transition of cell cycle (GO:1902099),0.8981284826066412,191.0,0.8971546208131891,407.0
chromatin assembly or disassembly (GO:0006333),0.8979874215063692,192.0,1.0914880969544623,137.0
serine family amino acid biosynthetic process (GO:0009070),0.897942631823311,193.0,0.9911485755057481,246.0
positive regulation of mitotic cell cycle phase transition (GO:1901992),0.8972039607335468,194.0,0.9775779876832398,259.0
regulation of lipid kinase activity (GO:0043550),0.8962506248984877,195.0,0.9924917449560974,244.0
mitochondrial DNA metabolic process (GO:0032042),0.8937586739480624,196.0,0.9062772698072109,395.0
negative regulation of ryanodine-sensitive calcium-release channel activity (GO:0060315),0.8925078802203904,197.5,0.8617933481844998,500.5
negative regulation of release of sequestered calcium ion into cytosol (GO:0051280),0.8925078802203904,197.5,0.8617933481844998,500.5
positive regulation of protein polyubiquitination (GO:1902916),0.8924758932116725,199.0,0.727717426958141,974.0
"DNA-templated transcription, termination (GO:0006353)",0.8923367260575453,200.0,1.0266323926093386,207.0
negative regulation of meiotic nuclear division (GO:0045835),0.8915815554069958,201.0,1.031138563386445,204.0
transport along microtubule (GO:0010970),0.8914059067338279,202.0,1.1861480982906596,82.0
positive regulation of ligase activity (GO:0051351),0.8911863585521327,203.0,1.1269404550292013,113.0
chromatin-mediated maintenance of transcription (GO:0048096),0.8907069525713716,204.5,0.9413886133368365,321.5
chromatin organization involved in regulation of transcription (GO:0034401),0.8907069525713716,204.5,0.9413886133368365,321.5
nucleoside salvage (GO:0043174),0.8896178089282232,206.0,0.8263455936580522,598.0
negative regulation of intrinsic apoptotic signaling pathway by p53 class mediator (GO:1902254),0.8895278014377812,207.0,1.106883327008224,128.0
positive regulation of transporter activity (GO:0032411),0.8892726752994425,208.0,0.8346104060958676,576.0
regulation of chemokine-mediated signaling pathway (GO:0070099),0.8888463539305916,209.0,0.9188356091300589,370.0
mRNA pseudouridine synthesis (GO:1990481),0.8875025949317695,210.0,1.2431392733995263,65.0
nucleosome assembly (GO:0006334),0.8869927667289877,211.0,1.1090359576496769,127.0
acid secretion (GO:0046717),0.8863910638262604,212.0,0.5979448969646374,1796.0
regulation of mitotic metaphase/anaphase transition (GO:0030071),0.8845307092295231,213.0,0.9539631552732956,300.0
amine transport (GO:0015837),0.8837447962325535,214.0,0.9143980933950362,376.0
mitotic nuclear membrane disassembly (GO:0007077),0.8829754428896516,215.0,0.7846870220858261,719.0
late nucleophagy (GO:0044805),0.8826742457436506,216.0,1.0901243402024672,142.0
DNA biosynthetic process (GO:0071897),0.8802916110847566,217.0,1.0553094917427879,176.0
mitotic cytokinesis (GO:0000281),0.8798589820068153,218.0,0.9007762221818005,402.0
protein localization to vacuole (GO:0072665),0.8796358765254202,219.0,0.9344384824046573,334.0
positive regulation of T-helper 2 cell differentiation (GO:0045630),0.87921327199582,220.0,0.8901258357332235,428.0
replication-born double-strand break repair via sister chromatid exchange (GO:1990414),0.8787176290840201,221.0,1.174116298352503,88.0
regulation of microtubule depolymerization (GO:0031114),0.8770497577566508,222.0,0.9456611059646295,315.0
regulation of cyclin-dependent protein kinase activity (GO:1904029),0.8765241663828877,223.0,0.9998104768237313,236.0
epiboly involved in wound healing (GO:0090505),0.8764663034918286,224.0,0.8458449113486871,534.0
negative regulation of protein depolymerization (GO:1901880),0.8763024116772624,225.0,0.9295477418494689,346.0
DNA unwinding involved in DNA replication (GO:0006268),0.8728414199902034,226.0,0.8581458354130682,505.0
regulation of nuclear cell cycle DNA replication (GO:0033262),0.8721329391128257,227.0,0.9074981228122952,393.0
alpha-beta T cell activation (GO:0046631),0.8712058987195146,228.0,0.9071855308012633,394.0
exonucleolytic catabolism of deadenylated mRNA (GO:0043928),0.8705941227753122,229.0,1.0163324193620487,221.0
regulation of leukocyte activation (GO:0002694),0.8676376641700572,230.0,0.7931648430812596,696.0
"DNA damage response, signal transduction resulting in transcription (GO:0042772)",0.8662906006387495,231.5,1.0053874606487123,225.5
"DNA damage response, signal transduction by p53 class mediator resulting in transcription of p21 class mediator (GO:0006978)",0.8662906006387495,231.5,1.0053874606487123,225.5
negative regulation of DNA recombination (GO:0045910),0.8650133547598893,233.0,1.0669884711624105,165.0
postsynaptic density organization (GO:0097106),0.8648219176227622,234.0,0.7716108009974271,770.0
small nucleolar ribonucleoprotein complex assembly (GO:0000491),0.8645638320239176,235.5,1.0622318930605064,171.5
box C/D snoRNP assembly (GO:0000492),0.8645638320239176,235.5,1.0622318930605064,171.5
regulation of T-helper 2 cell differentiation (GO:0045628),0.8633415435830413,237.0,0.8328642159965425,582.0
plus-end-directed organelle transport along microtubule (GO:0072386),0.8621973347732689,238.5,1.0702172081765033,161.5
plus-end-directed vesicle transport along microtubule (GO:0072383),0.8621973347732689,238.5,1.0702172081765033,161.5
regulation of microtubule polymerization or depolymerization (GO:0031110),0.8604592608327967,240.0,0.9740327305248967,264.0
positive regulation by symbiont of host autophagy (GO:0075044),0.8580850840937833,241.0,1.3028566951406018,45.0
regulation of chromosome segregation (GO:0051983),0.8575059315104995,242.0,0.8878954196292923,432.0
regulation of protein lipidation (GO:1903059),0.8565713084217705,243.0,0.69882586470505,1110.0
COPI coating of Golgi vesicle (GO:0048205),0.8564710589380847,245.0,0.7324333327273113,953.0
Golgi transport vesicle coating (GO:0048200),0.8564710589380847,245.0,0.7324333327273113,953.0
COPI-coated vesicle budding (GO:0035964),0.8564710589380847,245.0,0.7324333327273113,953.0
heterochromatin assembly (GO:0031507),0.8552527689724676,247.0,0.9379961630450688,325.0
nuclear membrane reassembly (GO:0031468),0.8538209323789798,249.0,1.0502653390321388,181.0
mitotic nuclear membrane organization (GO:0101024),0.8538209323789798,249.0,1.0502653390321388,181.0
mitotic nuclear membrane reassembly (GO:0007084),0.8538209323789798,249.0,1.0502653390321388,181.0
mitotic spindle assembly (GO:0090307),0.8520470581548191,251.0,0.9557995039253123,299.0
regulation of protein localization to cell cortex (GO:1904776),0.8515082061436647,252.5,0.8401165474124354,551.5
positive regulation of protein localization to cell cortex (GO:1904778),0.8515082061436647,252.5,0.8401165474124354,551.5
