set,Real_Score,Real_Rank,Syn_Score,Syn_Rank
negative regulation of transcription from RNA polymerase II promoter in response to stress (GO:0097201),0.5755634223649039,1253.0,0.45768974570626125,3414.0
positive regulation of histone modification (GO:0031058),0.575272916681598,1254.0,0.7240654881402001,992.0
positive regulation of granulocyte differentiation (GO:0030854),0.5752569174934719,1255.5,0.7109299017166215,1052.5
regulation of granulocyte differentiation (GO:0030852),0.5752569174934719,1255.5,0.7109299017166215,1052.5
taurine metabolic process (GO:0019530),0.5751229535477413,1257.0,0.6014321415077816,1769.0
response to interleukin-6 (GO:0070741),0.5750916427903623,1258.0,0.6656713051407315,1312.0
regulation of B cell apoptotic process (GO:0002902),0.5750345293661067,1259.0,0.4967384449542996,2945.0
negative regulation of oxidoreductase activity (GO:0051354),0.5749321881716556,1260.0,0.7068698521787846,1077.0
small GTPase mediated signal transduction (GO:0007264),0.574931360647056,1261.0,0.6387235707995962,1498.0
negative regulation of mRNA catabolic process (GO:1902373),0.5747257688961999,1262.0,0.6238300344384528,1607.0
regulation of T-helper cell differentiation (GO:0045622),0.5746627240993872,1263.0,0.48216626590215933,3121.0
negative regulation of stress fiber assembly (GO:0051497),0.5744035502062673,1264.0,0.664463286862456,1326.0
protein neddylation (GO:0045116),0.5737655068988831,1265.0,0.7192342066699059,1011.0
positive regulation of telomere capping (GO:1904355),0.5736994905751341,1266.5,0.5788923476807591,1965.5
regulation of telomere capping (GO:1904353),0.5736994905751341,1266.5,0.5788923476807591,1965.5
glycerol metabolic process (GO:0006071),0.5735786391785272,1268.0,0.8181736379941422,616.0
regulation of nucleobase-containing compound metabolic process (GO:0019219),0.5730062773619787,1269.0,0.5232916216606894,2618.0
regulation of cellular ketone metabolic process (GO:0010565),0.5729124761715306,1270.0,0.794013015225336,691.0
regulation of nuclear-transcribed mRNA poly(A) tail shortening (GO:0060211),0.5728474076891306,1271.5,0.5313747547311127,2534.5
positive regulation of nuclear-transcribed mRNA poly(A) tail shortening (GO:0060213),0.5728474076891306,1271.5,0.5313747547311127,2534.5
negative regulation of cellular amide metabolic process (GO:0034249),0.5727829706774148,1273.0,0.7290649738888298,970.0
positive regulation of protein kinase activity (GO:0045860),0.5726886950264507,1274.0,0.6499443887164973,1428.0
peptidyl-lysine modification (GO:0018205),0.5726649894606087,1275.0,0.7033092441500894,1096.0
gene silencing by miRNA (GO:0035195),0.5722699386947346,1276.0,0.6613136106794624,1346.0
negative regulation of erythrocyte differentiation (GO:0045647),0.5721486443757107,1277.0,0.5861310403944893,1904.0
negative regulation of mitotic cell cycle phase transition (GO:1901991),0.5719473055255514,1278.0,0.7835178535873676,729.0
dendritic cell migration (GO:0036336),0.5718586658251671,1279.0,0.5928738445317561,1839.0
regulation of RNA metabolic process (GO:0051252),0.5717740306083264,1280.0,0.7137982452712318,1038.0
regulation of autophagosome maturation (GO:1901096),0.5717610754510024,1281.0,0.6941457433609866,1133.0
regulation of respiratory burst (GO:0060263),0.5714595949674719,1282.0,0.4787495739859727,3162.0
regulation of natural killer cell proliferation (GO:0032817),0.5713990094403781,1283.0,0.7349090118406724,934.0
regulation of Ras protein signal transduction (GO:0046578),0.5712724514413611,1284.0,0.6293908220431429,1563.0
"RNA splicing, via transesterification reactions (GO:0000375)",0.5711755314688794,1285.0,0.8803538006623519,448.0
positive regulation of transcription of Notch receptor target (GO:0007221),0.5710780693635475,1286.0,0.7844941348861951,721.0
cellular response to calcium ion (GO:0071277),0.5708784424128198,1287.0,0.6489707525820183,1432.0
negative regulation of G2/M transition of mitotic cell cycle (GO:0010972),0.5707874622478536,1288.0,0.8227649002898714,609.0
positive regulation of protein autophosphorylation (GO:0031954),0.570702381400297,1289.0,0.5136016761525088,2748.0
response to ketone (GO:1901654),0.5706855835669409,1290.0,0.5474820250676535,2316.0
myelination in peripheral nervous system (GO:0022011),0.5703482763200273,1291.0,0.4772452592066922,3180.0
establishment of epithelial cell polarity (GO:0090162),0.5703177303223934,1292.0,0.37238917108470804,4255.0
Golgi localization (GO:0051645),0.570064083535581,1293.0,0.925871152044706,360.0
negative regulation of oxidative stress-induced intrinsic apoptotic signaling pathway (GO:1902176),0.5699616417791777,1294.0,0.5277372821225037,2575.0
proteasomal ubiquitin-independent protein catabolic process (GO:0010499),0.5696822814266095,1295.0,0.7712618584949983,773.0
protein autophosphorylation (GO:0046777),0.56965435533133,1296.0,0.6689283403996497,1287.0
positive regulation of insulin secretion (GO:0032024),0.5694630722288122,1297.0,0.6039730114072107,1749.0
positive regulation of autophagosome assembly (GO:2000786),0.5693363866712245,1298.0,0.8259032930886292,600.0
mitotic recombination (GO:0006312),0.5691352625624431,1299.0,0.8145624743163767,623.0
regulation of cell development (GO:0060284),0.5689103392942321,1300.0,0.7216598508301523,1002.0
amino acid transmembrane transport (GO:0003333),0.5685294522320958,1301.0,0.6353374260590435,1523.0
positive regulation of ER-associated ubiquitin-dependent protein catabolic process (GO:1903071),0.567646392114946,1302.0,0.42855313240020526,3738.0
negative regulation of keratinocyte proliferation (GO:0010839),0.5674290433191823,1303.0,0.4375517108733566,3650.0
regulation of small GTPase mediated signal transduction (GO:0051056),0.567319349178566,1304.0,0.6272465342658216,1582.0
positive regulation of mitochondrion organization (GO:0010822),0.5672862776218996,1305.0,0.5983187848360992,1792.0
postsynaptic membrane organization (GO:0001941),0.5667992089458521,1306.0,0.5388169432824971,2439.0
neurotransmitter transport (GO:0006836),0.5667107643508336,1307.0,0.6564376182184865,1381.0
melanocyte differentiation (GO:0030318),0.5667035019109337,1308.0,0.6369137431535552,1510.0
very long-chain fatty acid biosynthetic process (GO:0042761),0.5659206930179473,1311.0,0.6059865004332312,1732.0
"fatty acid elongation, polyunsaturated fatty acid (GO:0034626)",0.5659206930179473,1311.0,0.6059865004332312,1732.0
"fatty acid elongation, monounsaturated fatty acid (GO:0034625)",0.5659206930179473,1311.0,0.6059865004332312,1732.0
"fatty acid elongation, unsaturated fatty acid (GO:0019368)",0.5659206930179473,1311.0,0.6059865004332312,1732.0
"fatty acid elongation, saturated fatty acid (GO:0019367)",0.5659206930179473,1311.0,0.6059865004332312,1732.0
glandular epithelial cell differentiation (GO:0002067),0.5657936678733732,1314.0,0.5814725734321742,1942.0
regulation of MHC class I biosynthetic process (GO:0045343),0.565333991530362,1315.0,0.9315236484672317,340.0
double-strand break repair via nonhomologous end joining (GO:0006303),0.5653327942291902,1316.0,0.7338241497501662,938.0
regulation of fibroblast proliferation (GO:0048145),0.5653257721975788,1317.0,0.6392592371593261,1492.0
positive regulation of establishment of protein localization to mitochondrion (GO:1903749),0.5651924601254112,1318.0,0.622719267264729,1614.0
negative regulation of RIG-I signaling pathway (GO:0039536),0.5650468013839782,1319.0,0.6268664265020122,1585.0
positive regulation of histone deacetylation (GO:0031065),0.5648669722778121,1320.0,0.5957610324953171,1810.0
cellular response to glucocorticoid stimulus (GO:0071385),0.5645268179181131,1321.0,0.5657595327976485,2094.0
forelimb morphogenesis (GO:0035136),0.5645047479209718,1322.0,0.5750685757817913,2007.0
response to peptide hormone (GO:0043434),0.5644880958031585,1323.0,0.5201393672537666,2659.0
negative regulation of lymphocyte apoptotic process (GO:0070229),0.5637897184647611,1324.0,0.5447189002629421,2354.0
"maturation of LSU-rRNA from tricistronic rRNA transcript (SSU-rRNA, 5.8S rRNA, LSU-rRNA) (GO:0000463)",0.5636262875860615,1325.0,0.781505991752156,737.0
NIK/NF-kappaB signaling (GO:0038061),0.563503978583936,1326.0,0.7574177508459207,829.0
histone methylation (GO:0016571),0.5634302712087911,1327.0,0.6800810701936177,1222.0
positive regulation of peptidyl-lysine acetylation (GO:2000758),0.5630403390839003,1328.0,0.7733295235802169,765.0
positive regulation of chromatin organization (GO:1905269),0.5629660605145412,1329.0,0.6807957162326109,1216.0
positive regulation of protein-containing complex disassembly (GO:0043243),0.5628778757246736,1330.0,0.6023333763285447,1763.0
cellular response to thyroid hormone stimulus (GO:0097067),0.562795381547725,1331.5,0.4422618819576628,3598.5
response to thyroid hormone (GO:0097066),0.562795381547725,1331.5,0.4422618819576628,3598.5
regulation of helicase activity (GO:0051095),0.5626542324161459,1333.0,0.8131037220555459,631.0
regulation of T cell mediated immune response to tumor cell (GO:0002840),0.5626158387496619,1334.0,0.3360846846986551,4458.0
homophilic cell adhesion via plasma membrane adhesion molecules (GO:0007156),0.562476522417187,1335.0,0.5638728065327105,2120.0
cellular response to corticosteroid stimulus (GO:0071384),0.5624219868652721,1336.0,0.5292643222223681,2561.0
activation of protein kinase activity (GO:0032147),0.5624141515796716,1337.0,0.5883654190656832,1884.0
negative regulation of vascular permeability (GO:0043116),0.5622843805283237,1338.0,0.497574158108959,2926.0
lytic vacuole organization (GO:0080171),0.5622741138251803,1339.0,0.47958056033722196,3153.0
response to leptin (GO:0044321),0.5622211246941706,1340.0,0.517609778265282,2689.0
sympathetic ganglion development (GO:0061549),0.5621746691054632,1341.0,0.46019814925669555,3387.0
arginine metabolic process (GO:0006525),0.5617251001779053,1342.0,0.6674471066091718,1296.0
proteoglycan biosynthetic process (GO:0030166),0.5615597479966176,1343.0,0.6040388952505855,1747.0
regulation of cell cycle (GO:0051726),0.5613969467704143,1344.0,0.6101858765085935,1706.0
positive regulation of meiotic nuclear division (GO:0045836),0.5612971933315752,1345.0,0.6163981173748432,1661.0
regulation of transport (GO:0051049),0.5612161864593916,1346.0,0.41932857188880385,3832.0
glycerophospholipid metabolic process (GO:0006650),0.5611440347898046,1347.0,0.6185084628977443,1641.0
regulation of transcription from RNA polymerase II promoter in response to hypoxia (GO:0061418),0.5610903349901614,1348.0,0.7429308602356264,891.0
glucose transmembrane transport (GO:1904659),0.5609422487417417,1349.0,0.5736932058421687,2023.0
regulation of transcription from RNA polymerase II promoter in response to stress (GO:0043618),0.5608755276359909,1350.0,0.7421264932600073,897.0
inositol phosphate-mediated signaling (GO:0048016),0.5608338962530431,1351.0,0.45931421814201895,3399.0
"nuclear-transcribed mRNA catabolic process, deadenylation-independent decay (GO:0031086)",0.5605935516892219,1352.0,0.6024842455301904,1761.0
negative regulation of cell cycle G2/M phase transition (GO:1902750),0.5605752950834569,1353.0,0.8497784955436494,528.0
"nucleotide-excision repair, DNA damage recognition (GO:0000715)",0.5603301436687498,1354.0,0.6897480805086353,1159.0
cellular response to increased oxygen levels (GO:0036295),0.560042208255575,1355.0,0.8662401836780558,484.0
Ras protein signal transduction (GO:0007265),0.5599266749727595,1356.0,0.5702984134727002,2047.0
protein polyglutamylation (GO:0018095),0.559908199331095,1357.0,0.8210230608139748,611.0
L-ascorbic acid metabolic process (GO:0019852),0.5592838180045441,1358.0,0.6705694585401288,1278.0
macrophage differentiation (GO:0030225),0.5591740268556227,1359.0,0.5652079388558526,2098.0
interleukin-23-mediated signaling pathway (GO:0038155),0.558991406381041,1360.0,0.8955335808581164,411.0
microtubule bundle formation (GO:0001578),0.5588018116644456,1361.0,0.5871225643918727,1894.0
embryonic organ morphogenesis (GO:0048562),0.5587124326624614,1362.0,0.5834519915177684,1926.0
regulation of programmed cell death (GO:0043067),0.5586314079667071,1363.0,0.6325616935620971,1538.0
positive regulation of macrophage chemotaxis (GO:0010759),0.5582877743603604,1364.0,0.5421787340248837,2400.0
intra-Golgi vesicle-mediated transport (GO:0006891),0.5582371683048615,1365.0,0.6071585451435202,1725.0
negative regulation of cAMP-dependent protein kinase activity (GO:2000480),0.5581953197475673,1366.0,0.5223841633541779,2630.0
regulation of reactive oxygen species biosynthetic process (GO:1903426),0.5581667531884746,1367.0,0.650885102255069,1421.0
glutathione metabolic process (GO:0006749),0.5581636531359492,1368.0,0.6621919764068356,1340.0
negative regulation of axonogenesis (GO:0050771),0.5581132833521781,1369.0,0.6746598353634496,1254.0
canonical glycolysis (GO:0061621),0.557505918960331,1370.5,0.6871733055760644,1178.5
glucose catabolic process to pyruvate (GO:0061718),0.557505918960331,1370.5,0.6871733055760644,1178.5
amyloid precursor protein metabolic process (GO:0042982),0.5574689995768035,1372.0,0.7554037971261718,834.0
positive regulation of protein modification by small protein conjugation or removal (GO:1903322),0.5573292701550423,1373.0,0.5183712280786261,2681.0
early endosome to late endosome transport (GO:0045022),0.557255624081127,1374.0,0.5416358233248842,2407.0
glycolipid biosynthetic process (GO:0009247),0.5568574923587651,1375.0,0.6661262488698823,1304.0
endothelium development (GO:0003158),0.556676559678937,1376.0,0.5857964621676544,1907.0
cellular response to alcohol (GO:0097306),0.5566390576270619,1377.0,0.5355615135427567,2484.0
negative regulation of G1/S transition of mitotic cell cycle (GO:2000134),0.5561746161084827,1378.0,0.5708105549627466,2045.0
oxaloacetate transport (GO:0015729),0.5557559427297407,1379.0,0.6313472924283998,1554.0
signal peptide processing (GO:0006465),0.5555137423221079,1380.0,0.7917285167766259,702.0
artery morphogenesis (GO:0048844),0.5551042832812165,1381.0,0.557966869043691,2191.0
response to prostaglandin E (GO:0034695),0.5549706218010914,1382.0,0.5975708015427779,1798.0
negative regulation of cyclin-dependent protein serine/threonine kinase activity (GO:0045736),0.5549000837085961,1383.5,0.6229358437925685,1612.5
negative regulation of cyclin-dependent protein kinase activity (GO:1904030),0.5549000837085961,1383.5,0.6229358437925685,1612.5
tyrosine catabolic process (GO:0006572),0.5548550771337821,1385.0,0.42135954765282924,3812.0
regulation of supramolecular fiber organization (GO:1902903),0.5544256636236156,1386.0,0.7281196682652239,973.0
protection from non-homologous end joining at telomere (GO:0031848),0.5542918266600122,1387.0,0.6265123370661249,1589.0
regulation of reactive oxygen species metabolic process (GO:2000377),0.5542897774997845,1388.0,0.6947279983625606,1128.0
dephosphorylation (GO:0016311),0.5541673661635855,1389.0,0.6183805629103132,1642.0
negative regulation of fat cell differentiation (GO:0045599),0.5541357761425091,1390.0,0.7128825168427689,1042.0
positive regulation of ubiquitin-protein transferase activity (GO:0051443),0.5540976565731572,1391.0,0.6183037823413376,1644.0
phosphatidylserine metabolic process (GO:0006658),0.5540241506879708,1392.0,0.591829492821182,1852.0
"positive regulation of nuclear-transcribed mRNA catabolic process, deadenylation-dependent decay (GO:1900153)",0.5539944325424627,1393.5,0.627591545510221,1579.5
"regulation of nuclear-transcribed mRNA catabolic process, deadenylation-dependent decay (GO:1900151)",0.5539944325424627,1393.5,0.627591545510221,1579.5
protein deubiquitination (GO:0016579),0.5539432830131573,1395.0,0.6795356057857648,1224.0
nucleobase-containing small molecule catabolic process (GO:0034656),0.5537921188154283,1396.0,0.6933407041518818,1136.0
positive regulation of lymphocyte differentiation (GO:0045621),0.5537562508930367,1397.0,0.5924793875334908,1841.0
regulation of phospholipase A2 activity (GO:0032429),0.5537451238026762,1398.0,0.5066527830234054,2817.0
regulation of neurotransmitter transport (GO:0051588),0.5537194055513794,1399.0,0.592040800388857,1848.0
2-oxoglutarate metabolic process (GO:0006103),0.553697358016689,1400.0,0.5734975087017379,2024.0
neuron migration (GO:0001764),0.5535334391395218,1401.0,0.5794444743778284,1963.0
isotype switching (GO:0045190),0.5532437220720754,1402.5,0.9274530366830891,352.5
somatic recombination of immunoglobulin genes involved in immune response (GO:0002204),0.5532437220720754,1402.5,0.9274530366830891,352.5
protein dephosphorylation (GO:0006470),0.5532000295132786,1404.0,0.6235297281887456,1608.0
carnitine metabolic process (GO:0009437),0.5529771673158295,1405.0,0.5528029051997588,2254.0
mitochondrial membrane organization (GO:0007006),0.552904125746812,1406.0,0.6689822080799881,1286.0
regulation of histone deacetylation (GO:0031063),0.5528758439960432,1407.0,0.6319990298304062,1548.0
thyroid gland development (GO:0030878),0.5528754164764778,1408.0,0.5583553182365263,2189.0
oligodendrocyte differentiation (GO:0048709),0.5522876089083439,1409.0,0.6658547722484585,1311.0
positive regulation of protein-containing complex assembly (GO:0031334),0.5522645517166814,1410.0,0.6696379910753497,1284.0
cAMP-mediated signaling (GO:0019933),0.5522102802664283,1411.0,0.631714614237219,1552.0
regulation of ketone biosynthetic process (GO:0010566),0.5521639637567773,1412.0,0.5208486399843795,2651.0
cellular response to oxygen levels (GO:0071453),0.5520667235956992,1413.0,0.6597159694345188,1363.0
protein monoubiquitination (GO:0006513),0.552025273390077,1414.0,0.7080186704957331,1069.0
regulation of macrophage migration (GO:1905521),0.5516795706147818,1415.0,0.4844150702055008,3088.0
negative regulation of neural precursor cell proliferation (GO:2000178),0.551640471154424,1416.0,0.5667113863628364,2084.0
histone deacetylation (GO:0016575),0.5515784332178498,1417.0,0.6058295485114454,1738.0
"protein localization to chromosome, telomeric region (GO:0070198)",0.5515541312855893,1418.0,0.6589219335877111,1367.0
positive regulation of translation (GO:0045727),0.5514195554371356,1419.0,0.7426483606654714,896.0
protein polyubiquitination (GO:0000209),0.5509964970246849,1420.0,0.6675800347825371,1295.0
artery development (GO:0060840),0.5508589960062992,1421.0,0.6022909754147239,1764.0
regulation of production of miRNAs involved in gene silencing by miRNA (GO:1903798),0.5508402848840841,1422.0,0.76303733357746,805.0
cellular response to interleukin-2 (GO:0071352),0.5506147919220713,1423.5,0.68034024105865,1220.5
interleukin-2-mediated signaling pathway (GO:0038110),0.5506147919220713,1423.5,0.68034024105865,1220.5
peptidyl-serine modification (GO:0018209),0.5505193045770893,1425.0,0.5693333251332032,2055.0
negative regulation of systemic arterial blood pressure (GO:0003085),0.5504343799035419,1426.0,0.6382458918354235,1503.0
Notch signaling pathway (GO:0007219),0.5503841249549747,1427.0,0.6949039914509598,1126.0
regulation of macrophage derived foam cell differentiation (GO:0010743),0.550321656304668,1428.0,0.5192523437210153,2672.0
regulation of acute inflammatory response (GO:0002673),0.5503209598482016,1429.0,0.5710152174903841,2042.0
positive regulation of alpha-beta T cell activation (GO:0046635),0.5502683815307137,1430.0,0.6204374002075667,1632.0
apoptotic nuclear changes (GO:0030262),0.5501712915029093,1431.0,0.699608155474735,1107.0
regulation of actin polymerization or depolymerization (GO:0008064),0.5499899424193194,1432.0,0.547965181819029,2308.0
regulation of dendrite development (GO:0050773),0.549959719276354,1433.0,0.4819970901342277,3125.0
folic acid transport (GO:0015884),0.5497713821636117,1434.0,0.4092280434681278,3924.0
protein modification by small protein conjugation (GO:0032446),0.5497547366230578,1435.0,0.6549092206031661,1390.0
positive regulation of leukocyte degranulation (GO:0043302),0.5496562850820907,1436.0,0.6408749414581714,1482.0
definitive hemopoiesis (GO:0060216),0.549605276769594,1437.0,0.465901953761739,3326.0
granulocyte differentiation (GO:0030851),0.5496034918459424,1438.0,0.638565453552416,1500.0
regulation of protein localization to cell periphery (GO:1904375),0.5494757312225271,1439.0,0.6704077017619006,1279.0
phagosome maturation (GO:0090382),0.5494148458098623,1440.0,0.6208460310986286,1628.0
regulation of cellular catabolic process (GO:0031329),0.5492966963697073,1441.0,0.6329127346739155,1535.0
negative regulation of acute inflammatory response (GO:0002674),0.5490018869219911,1442.0,0.5690875663008313,2058.0
heart trabecula formation (GO:0060347),0.5489048398370794,1443.0,0.5689685337069134,2059.0
membrane fusion (GO:0061025),0.5488397486955926,1444.0,0.6784214493135429,1234.0
negative regulation of cAMP-mediated signaling (GO:0043951),0.5486985281502172,1445.0,0.5011911985838323,2877.0
negative regulation of cellular metabolic process (GO:0031324),0.5484176996237055,1446.0,0.5441308065123077,2368.0
cellular modified amino acid biosynthetic process (GO:0042398),0.5483987837749995,1447.0,0.6230131642928985,1610.0
phospholipid dephosphorylation (GO:0046839),0.5483831278565575,1448.0,0.5390859375573294,2433.0
organelle assembly (GO:0070925),0.5482244855866023,1449.0,0.6446000400668205,1460.0
negative regulation of histone acetylation (GO:0035067),0.5481287927898999,1450.0,0.8367708924046342,569.0
negative regulation of actin filament bundle assembly (GO:0032232),0.5480941287625087,1451.0,0.6470633251130741,1444.0
cytosolic transport (GO:0016482),0.5480048182640148,1452.0,0.6023974895313139,1762.0
tyrosine metabolic process (GO:0006570),0.5478835005120036,1453.0,0.4860098289117248,3072.0
neuron projection fasciculation (GO:0106030),0.5477808011569862,1454.0,0.7523336477086394,843.0
P-body assembly (GO:0033962),0.5477700895586922,1455.0,0.41262994554884,3892.0
positive regulation of membrane depolarization (GO:1904181),0.5476903592678508,1456.0,0.40589500054467464,3956.0
mRNA cleavage involved in mRNA processing (GO:0098787),0.5476877536681042,1457.0,0.6246696953389406,1597.0
cellular respiration (GO:0045333),0.5472839085476472,1458.0,0.6660360367654636,1308.0
histone monoubiquitination (GO:0010390),0.5472607388446397,1459.0,0.7462401392158997,871.0
regulation of glial cell migration (GO:1903975),0.547229923903441,1460.0,0.5384617268093264,2443.0
nitrogen compound transport (GO:0071705),0.5470419943373059,1461.0,0.5964575667766338,1804.0
retinal metabolic process (GO:0042574),0.5468506675079383,1462.0,0.47240227743527735,3239.0
ruffle organization (GO:0031529),0.5467994369795591,1463.0,0.685360477270431,1189.0
regulation of cytokinesis (GO:0032465),0.5467642616199455,1464.0,0.6816113172435421,1210.0
positive regulation of erythrocyte differentiation (GO:0045648),0.5463093930011522,1465.0,0.5296575052747416,2556.0
heart process (GO:0003015),0.5462021799624994,1466.0,0.6168817458493543,1656.0
regulation of kinase activity (GO:0043549),0.5460676068962453,1467.0,0.6449882335137094,1454.0
negative regulation of apoptotic signaling pathway (GO:2001234),0.5458236988091297,1468.0,0.7250807495504437,987.0
positive regulation of cysteine-type endopeptidase activity involved in apoptotic signaling pathway (GO:2001269),0.5456424573810975,1469.0,0.42463782687492624,3773.0
cholesterol transport (GO:0030301),0.5456267038363962,1470.0,0.5773008627004301,1980.0
lipoxin biosynthetic process (GO:2001301),0.5454161767731519,1471.0,0.6163780136197476,1662.0
response to calcium ion (GO:0051592),0.5454050844046288,1472.0,0.6258059428949653,1594.0
peroxisome proliferator activated receptor signaling pathway (GO:0035357),0.5453140179368744,1473.0,0.8057825530814461,652.0
regulation of long-term synaptic depression (GO:1900452),0.5452500200741761,1474.0,0.7703595462220674,778.0
nucleus organization (GO:0006997),0.5452439054617116,1475.0,0.7069782512875734,1076.0
steroid catabolic process (GO:0006706),0.5448820048191942,1476.0,0.5614962325984724,2153.0
regulation of leukocyte degranulation (GO:0043300),0.5448032915100776,1477.0,0.47345872555898116,3225.0
"nucleotide-binding domain, leucine rich repeat containing receptor signaling pathway (GO:0035872)",0.5446508103538635,1478.5,0.7335076593850977,945.5
nucleotide-binding oligomerization domain containing signaling pathway (GO:0070423),0.5446508103538635,1478.5,0.7335076593850977,945.5
glial cell migration (GO:0008347),0.5445159255169271,1480.0,0.5629196927029806,2137.0
icosanoid transport (GO:0071715),0.5439579142404117,1481.0,0.7238962146970389,993.0
nuclear envelope organization (GO:0006998),0.5439063010257648,1482.0,0.7008417501219381,1103.0
positive regulation of calcium ion transmembrane transporter activity (GO:1901021),0.5438185933035091,1483.0,0.7141950146039115,1035.0
regulation of response to DNA damage stimulus (GO:2001020),0.5437338935939016,1484.0,0.6902970173686801,1153.0
regulation of transforming growth factor beta receptor signaling pathway (GO:0017015),0.5434865321293028,1485.0,0.6059770649078543,1735.0
protein ubiquitination (GO:0016567),0.5431034135513559,1486.0,0.6459752889089884,1448.0
regulation of histone phosphorylation (GO:0033127),0.542972681316694,1487.0,0.5515941273292995,2265.0
positive regulation of alpha-beta T cell differentiation (GO:0046638),0.542730853264268,1488.0,0.5763387491279015,1991.0
RNA processing (GO:0006396),0.5426368158451872,1489.0,0.7962500460851026,682.0
regulation of calcium ion transmembrane transport via high voltage-gated calcium channel (GO:1902514),0.5426141191356993,1490.0,0.48153388651971035,3130.0
negative regulation of vitamin metabolic process (GO:0046137),0.5424540902592785,1491.0,0.35285927116932053,4377.0
natural killer cell mediated immunity (GO:0002228),0.5422516270828563,1492.0,0.6724474341914203,1265.0
establishment of protein localization to membrane (GO:0090150),0.5421464975320424,1493.0,0.6114371736096947,1698.0
protein heterooligomerization (GO:0051291),0.5418180831710934,1494.0,0.5540126826688635,2240.0
protein K63-linked deubiquitination (GO:0070536),0.5415200478157762,1495.0,0.7609377105304719,812.0
